81937;1;Gants Ixon RS WALL HP - Noir;218,169;82.40740741;1;45.32;1;;15;;;RPGIXGT111012;RPGIXGT111012;Redpoint;Ixon;;;;;;;;0;;;;;;Gant homme mi-saison étanche et légèrement doublé avec une coque très sobre recouverte de tissu. Sa matière Softshell lui apporte légèreté et sobriété. Certifié CE avec le Sensitive Touch System, son style est idéal pour l’utilisation du 2-roues urbain.;<p><strong>Materiaux</strong></p><ul><li>Etanche et respirant avec insert HIPORA</li><li>Doublure intégrale</li><li>Coque de protection sur le dos de la main recouverte de softshell</li><li>Renfort paume en chamude</li></ul><p><strong>Confort</strong></p><ul><li>Poignet élastiqué avec serrage velcro</li><li>Manchette mi-longue</li></ul>;;;;;;En Stock;Disponibilité: Délais sur demande;1;;;1;;0;Couleur:Noir:1,Genre:Homme:2,Matière:Textile:3,Saisonnalité:Mi-saison:4,Etanchéité:étanche;0;new;0;0;0;0;0;0;0;0
81938;1;Gants Ixon PRO BLIZZARD HP - Noir;217,169;119.4444444;1;65.69;1;;15;;;RPGIXGT121013;RPGIXGT121013;Redpoint;Ixon;;;;;;;;0;;;;;;Gant hiver très chaud étanche et confortable. Sa manchette longue très couvrante, sa coque intégrée recouverte de cuir le rendent parfait pour le touring. Il est en outre très technique : Sensitive Touch System, certifié CE, et une version couleur avec réflectif;<p><strong>Materiaux</strong></p><ul><li>Etanche et respirant avec insert HIPORA</li><li>Doublure hiver intégrale</li><li>Coque de protection sur le dos de la main recouverte de cuir</li><li>Renfort paume en chamude</li></ul><p><strong>Confort</strong></p><ul><li>Manchette longue avec serrage velcro</li><li>Poignet élastiqué avec serrage velcro</li></ul>;;;;;;En Stock;Disponibilité: Délais sur demande;1;;;1;;0;Couleur:Noir:1,Genre:Homme:2,Matière:Cuir et Textile:3,Saisonnalité:Hiver:4,Etanchéité:étanche;0;new;0;0;0;0;0;0;0;0
81940;1;Gants Ixon PRO BLAZE HP - Noir;217,169;82.40740741;1;45.32;1;;15;;;RPGIXGT131011;RPGIXGT131011;Redpoint;Ixon;;;;;;;;0;;;;;;"Ce gant hiver est à la fois chaud et fin et propose un excellent rapport qualité/prix ; certifié CE il existe en deux versions couleurs.";<p><strong>Materiaux</strong></p><ul><li>Gant textile</li><li>Insert HIPORA intégré, étanche et très respirant</li><li>Ouatine épaisse sur le dos de la main : au-dessus et en dessous de l’insert</li><li>Ouatine coté paume</li><li>Coque de protection sur le dos de la main</li></ul>;;;;;;En Stock;Disponibilité: Délais sur demande;1;;;1;;0;Couleur:Noir:1,Genre:Homme:2,Matière:Textile:3,Saisonnalité:Hiver:4,Etanchéité:étanche;0;new;0;0;0;0;0;0;0;0
81941;1;Gants Ixon PRO APEX 2 HP - Noir;217,169;119.4444444;1;65.69;1;;15;;;RPGIXGT131013;RPGIXGT131013;Redpoint;Ixon;;;;;;;;0;;;;;;Gant long typé sport pour l’hiver. Doublé en thermo-alu sur le dos de la main, il reste très fin en paume pour une bonne préhension. Certifié CE, sa coque est recouverte de cuir et le « Sensitive Touch System » permet d’utiliser son écran tactile.;<p><strong>Materiaux</strong></p><ul><li>Etanche et respirant avec insert HIPORA</li><li>Doublure hiver avec aluminium sur le dessus</li><li>Coque de protection sur le dos de la main</li><li>Renfort paume en chamude</li><li>Slider en bas de paume</li></ul><p><strong>Confort</strong></p><ul><li>Manchette longue en néoprène avec serrage velcro</li><li>Poignet élastiqué avec serrage velcro</li></ul>;;;;;;En Stock;Disponibilité: Délais sur demande;1;;;1;;0;Couleur:Noir:1,Genre:Homme:2,Matière:Cuir et Textile:3,Saisonnalité:Hiver:4,Etanchéité:étanche;0;new;0;0;0;0;0;0;0;0
81942;1;Gants Ixon PRO APEX 2 HP - Noir/Rouge;217,169;119.4444444;1;65.69;1;;15;;;RPGIXGT131581;RPGIXGT131581;Redpoint;Ixon;;;;;;;;0;;;;;;Gant long typé sport pour l’hiver. Doublé en thermo-alu sur le dos de la main, il reste très fin en paume pour une bonne préhension. Certifié CE, sa coque est recouverte de cuir et le « Sensitive Touch System » permet d’utiliser son écran tactile.;<p><strong>Materiaux</strong></p><ul><li>Etanche et respirant avec insert HIPORA</li><li>Doublure hiver avec aluminium sur le dessus</li><li>Coque de protection sur le dos de la main</li><li>Renfort paume en chamude</li><li>Slider en bas de paume</li></ul><p><strong>Confort</strong></p><ul><li>Manchette longue en néoprène avec serrage velcro</li><li>Poignet élastiqué avec serrage velcro</li></ul>;;;;;;En Stock;Disponibilité: Délais sur demande;1;;;1;;0;Couleur:Noir/Rouge:1,Genre:Homme:2,Matière:Cuir et Textile:3,Saisonnalité:Hiver:4,Etanchéité:étanche;0;new;0;0;0;0;0;0;0;0
81943;1;Gants Ixon PRO APEX 2 HP - Noir/Jaune;217,169;119.4444444;1;65.69;1;;15;;;RPGIXGT131721;RPGIXGT131721;Redpoint;Ixon;;;;;;;;0;;;;;;Gant long typé sport pour l’hiver. Doublé en thermo-alu sur le dos de la main, il reste très fin en paume pour une bonne préhension. Certifié CE, sa coque est recouverte de cuir et le « Sensitive Touch System » permet d’utiliser son écran tactile.;<p><strong>Materiaux</strong></p><ul><li>Etanche et respirant avec insert HIPORA</li><li>Doublure hiver avec aluminium sur le dessus</li><li>Coque de protection sur le dos de la main</li><li>Renfort paume en chamude</li><li>Slider en bas de paume</li></ul><p><strong>Confort</strong></p><ul><li>Manchette longue en néoprène avec serrage velcro</li><li>Poignet élastiqué avec serrage velcro</li></ul>;;;;;;En Stock;Disponibilité: Délais sur demande;1;;;1;;0;Couleur:Noir/Jaune:1,Genre:Homme:2,Matière:Cuir et Textile:3,Saisonnalité:Hiver:4,Etanchéité:étanche;0;new;0;0;0;0;0;0;0;0
81945;1;Gants Ixon PRO DONNA HP - Noir;217,169;50.92592593;1;28.01;1;;15;;;RPGIXGT141013;RPGIXGT141013;Redpoint;Ixon;;;;;;;;0;;;;;;"Gant chaud pour femme en majorité de textile stretch ; ses trois versions couleurs se marient parfaitement avec la nouvelle veste Kashima HP ; étanche et respirant, il est certifié CE.";<p><strong>Materiaux</strong></p><ul><li>Gant en textile stretch, tout Confort</li><li>Insert Hipora intégré, étanche et très respirant</li><li>Ouatine épaisse sur le dos de la main : au-dessus et en dessous de l’insert</li><li></li><li>Ouatine coté paume</li></ul>;;;;;;En Stock;Disponibilité: Délais sur demande;1;;;1;;0;Couleur:Noir:1,Genre:Femme:2,Matière:Textile:3,Saisonnalité:Hiver:4,Etanchéité:étanche;0;new;0;0;0;0;0;0;0;0
81949;1;Gants Ixon PRO SPY HP - Noir;217,169;50.92592593;1;28.01;1;;15;;;RPGIXGT151012;RPGIXGT151012;Redpoint;Ixon;;;;;;;;0;;;;;;Pro Spy HP est notre premier gant entrée de gamme chaud et étanche en textile avec coque souple intégrée. Très confortable avec sa matière Stretch, il est également renforcé en paume et sur le côté pour répondre à la certification CE. C’est donc un EPI.;<p><strong>Materiaux</strong></p><ul><li>Tissu stretch</li><li>Étanche et respirant avec insert intégré</li><li>Coque souple et intégrée sur le dos de la main</li><li>Slider en bas de paume</li></ul>;;;;;;En Stock;Disponibilité: Délais sur demande;1;;;1;;0;Couleur:Noir:1,Genre:Homme:2,Matière:Textile:3,Saisonnalité:Hiver:4,Etanchéité:étanche;0;new;0;0;0;0;0;0;0;0
81952;1;Gants Ixon PRO DONNA HP - Noir/Blanc/Bleu;217,169;50.92592593;1;28.01;1;;15;;;RPGIXGT151791;RPGIXGT151791;Redpoint;Ixon;;;;;;;;0;;;;;;"Gant chaud pour femme en majorité de textile stretch ; ses trois versions couleurs se marient parfaitement avec la nouvelle veste Kashima HP ; étanche et respirant, il est certifié CE.";<p><strong>Materiaux</strong></p><ul><li>Gant en textile stretch, tout Confort</li><li>Insert Hipora intégré, étanche et très respirant</li><li>Ouatine épaisse sur le dos de la main : au-dessus et en dessous de l’insert</li><li></li><li>Ouatine coté paume</li></ul>;;;;;;En Stock;Disponibilité: Délais sur demande;1;;;1;;0;Couleur:Noir/Blanc/Bleu:1,Genre:Femme:2,Matière:Textile:3,Saisonnalité:Hiver:4,Etanchéité:étanche;0;new;0;0;0;0;0;0;0;0
81953;1;Gants Ixon PRO FIT HP - Noir;217,169;137.962963;1;75.88;1;;15;;;RPGIXGT161011;RPGIXGT161011;Redpoint;Ixon;;;;;;;;0;;;;;;"Ce gant haut de gamme concilie des caractéristiques racing qualitatives et une thermorégulation efficace. Il propose une manchette longue à double serrage une coque très protectrice et ventilée sur le dos de la main, un slider bas de paume et des renforts sur les doigts. Il est préformé et non doublé en paume pour garantir les sensations de conduite ; mais il est également conçu pour être étanche, respirant et chaud grâce à un insert et un double rembourrage sur le dos de la main. Cet EPI propose en outre le STS et permet l’utilisation des écrans tactiles.";<p><strong>Materiaux</strong></p><ul><li>Cuir de chèvre et stretch</li><li>Insert étanche et respirant intégré</li><li>Doublure chaude sur le dessus de la main : ouatine + Thinsulate</li><li>Intérieur du gant en micropolaire très douce</li><li>Paume en cuir de chèvre renforcée chamude imprimé, avec slider</li><li>Coque de protection exclusive sur le dos de la main avec ventilations intégrées</li></ul><p><strong>Confort</strong></p><ul><li>Longue manchette avec rubber de renfort</li><li>Flex sur les doigts</li><li>Serrage poignet par patte velcro</li><li>Serrage manchette par patte velcro</li></ul>;;;;;;En Stock;Disponibilité: Délais sur demande;1;;;1;;0;Couleur:Noir:1,Genre:Homme:2,Matière:Cuir et Textile:3,Saisonnalité:Hiver:4,Etanchéité:étanche;0;new;0;0;0;0;0;0;0;0
81954;1;Gants Ixon PRO ROLL HP - Noir;217,169;119.4444444;1;65.69;1;;15;;;RPGIXGT161012;RPGIXGT161012;Redpoint;Ixon;;;;;;;;0;;;;;;Ce gant en mix de softshell et de cuir vous permettra rouler dans les conditions les plus extrêmes. Sous un look sobre et une coque de protection intégrée se cache une doublure Thinsulate très efficace des deux côtés de la main. Grâce à sa majorité de softshell, Pro Roll Hp est également léger et hyper confortable, tout en étant certifié CE.;<p><strong>Materiaux</strong></p><ul><li>Dessus de la main en textile et softshell</li><li>Paume en cuir renforcée de chamude</li><li>Insert Etanche et respirant intégré</li><li>Ouatine et Thinsulate sur le dos de la main</li><li>Ouatine en paume</li><li>Doublure intérieure en fourrure polaire sur le dos de la main</li><li>Coque de protection recouverte sur le dos de la main</li></ul><p><strong>Confort</strong></p><ul><li>Manchette longue avec grande patte de serrage</li><li>Poignet élastiqué, avec boucle de serrage retenue par élastique</li></ul>;;;;;;En Stock;Disponibilité: Délais sur demande;1;;;1;;0;Couleur:Noir:1,Genre:Homme:2,Matière:Fibretextile:3,Saisonnalité:Hiver:4,Etanchéité:étanche;0;new;0;0;0;0;0;0;0;0
81956;1;Combi Ixon ZENITH - Blanc/Noir/Or;209,169;2128.703704;1;1170.79;1;;25;;;RPGIXLS112141;RPGIXLS112141;Redpoint;Ixon;;;;;;;;0;;;;;;Combinaison Kangourou 100% made by Ixon, aboutissement de notre implication au plus haut niveau de la compétition. Développée dans l’objectif du GP, standardisée pour tous les pilotes.;<p><strong>Materiaux</strong></p><ul><li>100% cuir de kangourou</li><li>Traitement silicone exclusif sur le cuir</li><li>Mousses « absorption d’impact » à l’intérieur</li><li>Stretch hyper extensible dans les 4 sens (43% d’élasticité)</li><li>Cuir flex doublé de jersey renforcé aux emmanchures et au bas du dos</li></ul><p><strong>Confort</strong></p><ul><li>Coutures sécurisées</li><li>Entièrement préformée</li></ul><p><strong>Caracteristiques</strong></p><ul><li>Livrée avec housse Suitcover, sliders et cache-velcro</li></ul>;;;;;;En Stock;Disponibilité: Délais sur demande;1;;;1;;0;Couleur:Blanc/Noir/Or:1,Genre:Homme:2,Fabricant:Ixon:3,Etanchéité:Non:4,Matière:Cuir:5,Saisonnalité:Toutes saisons:6,Ventilé:Oui:7,Bosse Aérodynamique:Oui:8;0;new;0;0;0;0;0;0;0;0
81957;1;Combi Ixon ZENITH - Blanc/Noir/Rouge;209,169;2128.703704;1;1170.79;1;;25;;;RPGIXLS112171;RPGIXLS112171;Redpoint;Ixon;;;;;;;;0;;;;;;Combinaison Kangourou 100% made by Ixon, aboutissement de notre implication au plus haut niveau de la compétition. Développée dans l’objectif du GP, standardisée pour tous les pilotes.;<p><strong>Materiaux</strong></p><ul><li>100% cuir de kangourou</li><li>Traitement silicone exclusif sur le cuir</li><li>Mousses « absorption d’impact » à l’intérieur</li><li>Stretch hyper extensible dans les 4 sens (43% d’élasticité)</li><li>Cuir flex doublé de jersey renforcé aux emmanchures et au bas du dos</li></ul><p><strong>Confort</strong></p><ul><li>Coutures sécurisées</li><li>Entièrement préformée</li></ul><p><strong>Caracteristiques</strong></p><ul><li>Livrée avec housse Suitcover, sliders et cache-velcro</li></ul>;;;;;;En Stock;Disponibilité: Délais sur demande;1;;;1;;0;Couleur:Blanc/Noir/Rouge:1,Genre:Homme:2,Fabricant:Ixon:3,Etanchéité:Non:4,Matière:Cuir:5,Saisonnalité:Toutes saisons:6,Ventilé:Oui:7,Bosse Aérodynamique:Oui:8;0;new;0;0;0;0;0;0;0;0
81964;1;Combi Ixon PULSAR - Noir/Blanc/Vert;209,169;832.4074074;1;457.82;1;;25;;;RPGIXLS151841;RPGIXLS151841;Redpoint;Ixon;;;;;;;;0;;;;;;Combinaison racing en vachette haute performance. Déclinaison de la « MotoGPExperience », sur un produit accessible conjuguant confort et protection pour les pilotes les plus exigeants.;<p><strong>Materiaux</strong></p><ul><li>100% cuir de vachette extra souple</li><li>Cuir perforé sur buste, cuisses et bras</li><li>Double épaisseur de cuir sur l’extérieur de la cuisse et sur les fesses</li></ul><p><strong>Confort</strong></p><ul><li>Coutures sécurisées</li><li>Buste, jambes, épaules et manches précurvés</li></ul><p><strong>Caracteristiques</strong></p><ul><li>Livrée avec sliders et cache-velcro</li></ul>;;;;;;En Stock;Disponibilité: Délais sur demande;1;;;1;;0;Couleur:Noir/Blanc/Vert:1,Genre:Homme:2,Fabricant:Ixon:3,Etanchéité:Non:4,Matière:Cuir:5,Saisonnalité:Toutes saisons:6,Ventilé:Oui:7,Bosse Aérodynamique:Non:8;0;new;0;0;0;0;0;0;0;0
81966;1;Pantalon Ixon COOLER - Noir;208,169;137.962963;1;75.88;1;;15;;;RPGIXPA151011;RPGIXPA151011;Redpoint;Ixon;;;;;;;;0;;;;;;Pantalon d’été léger et très ventilé, le Cooler Pant forme un ensemble avec le blouson Cooler, pour un budget très accessible. Il dispose du concept MCT pour s’adapter à toutes les morphologies, et de protections genoux certifiées.;<p><strong>Materiaux</strong></p><ul><li>Très ventilé grâce à de grands empiècements en mesh devant et derrière</li><li>Morpho Concept Technology : s’adapte à toutes les morphologies</li><li>Logos et piping réflectifs</li></ul><p><strong>Confort</strong></p><ul><li>Serrage taille par élastique et velcro</li><li>Fermeture par zip et pression</li></ul><p><strong>Caracteristiques</strong></p><ul><li>4 poches extérieures</li><li>Connexion par boucle et pression</li><li>Connexion avec zip au dos</li></ul>;;;;;;En Stock;Disponibilité: Délais sur demande;1;;;1;;0;Couleur:Noir:1,Genre:Homme:2,Fabricant:Ixon:3,Etanchéité:Non:4,Matière:Textile:5,Saisonnalité:été:6,Ventilé:Oui:7;0;new;0;0;0;0;0;0;0;0
81969;1;Pantalon Ixon ADDICT PANT - Noir/Blanc;208,169;397.2222222;1;218.47;1;;15;;;RPGIXPC121151;RPGIXPC121151;Redpoint;Ixon;;;;;;;;0;;;;;;Pantalon cuir au look racing très prononcé qui offre la technicité du GP, permettant ainsi une conduite sportive sur piste comme sur route.;<p><strong>Materiaux</strong></p><ul><li>100% cuir de vachette extra souple</li><li>Stretch à l’arrière des mollets et à l’entrejambes</li><li>Cuir flex au-dessus des genoux et derrière la ceinture</li></ul><p><strong>Caracteristiques</strong></p><ul><li>Livrée avec sliders et cache-velcro</li><li>Connexion avec zip 360° autour de la taille</li><li>Connexion avec zip au dos</li></ul>;;;;;;En Stock;Disponibilité: Délais sur demande;1;;;1;;0;Couleur:Noir/Blanc:1,Genre:Homme:2,Fabricant:Ixon:3,Etanchéité:Non:4,Matière:Cuir:5,Saisonnalité:été:6,Ventilé:Non:7;0;new;0;0;0;0;0;0;0;0
81970;1;Pantalon Ixon FUELLER - Noir/Blanc;208,169;221.2962963;1;121.71;1;;15;;;RPGIXPC13115;RPGIXPC13115;Redpoint;Ixon;;;;;;;;0;;;;;;Pantalon cuir racing très confortable aux finitions lui conférant un look qualitatif pour un prix très abordable. Forme un ensemble racing avec les blousons Fueller et Fueller Dry.;<p><strong>Materiaux</strong></p><ul><li>Cuir de vachette</li><li>Stretch à l’entrejambe et à l’arrière des mollets</li><li>Ceinture élastiquée</li><li>Tissu flex en bas du dos</li></ul><p><strong>Caracteristiques</strong></p><ul><li>Connexion avec zip 360° autour de la taille</li></ul>;;;;;;En Stock;Disponibilité: Délais sur demande;1;;;1;;0;Couleur:Noir/Blanc:1,Genre:Homme:2,Fabricant:Ixon:3,Etanchéité:Non:4,Matière:Cuir:5,Saisonnalité:été:6,Ventilé:Non:7;0;new;0;0;0;0;0;0;0;0
81971;1;Pantalon Ixon OXYD - Bleu;208,169;193.5185185;1;106.44;1;;15;;;RPGIXPL093011;RPGIXPL093011;Redpoint;Ixon;;;;;;;;0;;;;;;Version féminine du pantalon « Evil » de la marque Ixon, le jean « Oxyd » est un classique qui saura s’adapter à n’importe quelle morphologie, grâce à la Morpho Concept Technology qui autorise différentes longueurs de jambes et une taille réglable par un simple Velcro. ;<ul><li>Renforts KEVLAR® à l’intérieur, au niveau des hanches, fesses et genoux</li><li>Morpho Concept Technology : longueur des jambes réglable sur 3 niveaux par pressions</li><li>Emplacements pour protections genoux homologuées CE, sur 2 hauteurs</li><li>Protections homologuées CE aux genoux, design articulé ergonomique</li><li>Ceinture intégrée permettant un réglage de la taille par Velcro</li><li>Fermeture par zip + bouton</li><li>5 poches mains devant et derrière</li><li>Passants à la taille permettant le port d’une ceinture</li><li>Broderies</li><li>Surpiqures contrastées</li></ul>;;;;;;En Stock;Disponibilité: Délais sur demande;1;;;1;;0;Couleur:Bleu:1,Genre:Femme:2,Fabricant:Ixon:3,Etanchéité:Non:4,Matière:Textile:5,Saisonnalité:Toutes saison:6,Ventilé:Non:7;0;new;0;0;0;0;0;0;0;0
81972;1;Pantalon Ixon SAWYER - Noir;208,169;202.7777778;1;111.53;1;;15;;;RPGIXPL131011;RPGIXPL131011;Redpoint;Ixon;;;;;;;;0;;;;;;Jean spécial moto, coupe droite, finition coton noir huilé, surpiqures apparentes et genoux 3D pour un look très streetwear. Doté de protections genoux CE livrées dans leur pochette filet, il est renforcé en matière tissée sur les fesses, les hanches et les genoux. Pour un confort optimum, il est également doté du Morpho Concept Technology.;<p><strong>Materiaux</strong></p><ul><li>Renforts à l’intérieur, au niveau des fesses, hanches et genoux</li><li>Morpho Concept Technology pour adapter selon la morphologie</li><li>Taille ajustable</li><li>2 hauteurs de poches pour placer les protections CE genoux</li><li>Longueurs de jambes réglables par pressions sur 3 niveaux</li><li>Coupe droite, finition coton noir huilé, surpiqures apparentes et genoux 3D pour un look très streetwear</li></ul><p><strong>Confort</strong></p><ul><li>Serrage taille par Velcro</li><li>Fermeture par zip et bouton</li><li>Passants pour ceinture</li></ul><p><strong>Caracteristiques</strong></p><ul><li>6 poches</li></ul>;;;;;;En Stock;Disponibilité: Délais sur demande;1;;;1;;0;Couleur:Noir:1,Genre:Homme:2,Fabricant:Ixon:3,Etanchéité:Non:4,Matière:Textile:5,Saisonnalité:été:6,Ventilé:Non:7;0;new;0;0;0;0;0;0;0;0
81973;1;Pantalon Ixon DUSTIN - Bleu;208,449,169;193.5185185;1;106.44;1;;15;;;RPGIXPL133041;RPGIXPL133041;Redpoint;Ixon;;;;;;;;0;;;;;;Coupe classique avec un léger délavage et des surpiqures contrastées;<p><strong>Materiaux</strong></p><ul><li>Renforts à l’intérieur, au niveau des fesses, hanches et genoux</li><li>Morpho Concept Technology pour adapter selon la morphologie</li><li>Taille ajustable</li><li>2 hauteurs de poches pour placer les protections CE genoux</li><li>Longueurs de jambes réglables par pressions sur 3 niveaux</li><li>Coupe classique avec un léger délavage et des surpiqures contrastées</li></ul><p><strong>Confort</strong></p><ul><li>Serrage taille par Velcro</li><li>Fermeture par zip et bouton</li><li>Passants pour ceinture</li></ul><p><strong>Caracteristiques</strong></p><ul><li>4 poches</li></ul>;;;;;;En Stock;Disponibilité: Délais sur demande;1;;;1;;0;Couleur:Bleu:1,Genre:Homme:2,Fabricant:Ixon:3,Etanchéité:Non:4,Matière:Textile:5,Saisonnalité:été:6,Ventilé:Non:7;0;new;0;0;0;0;0;0;0;0
81974;1;Pantalon Ixon DUSTIN C - Bleu;208,449,169;249.0740741;1;136.99;1;;15;;;RPGIXPL133042;RPGIXPL133042;Redpoint;Ixon;;;;;;;;0;;;;;;Coupe classique avec un léger délavage et des surpiqures contrastées;<p><strong>Materiaux</strong></p><ul><li>Renforts à l’intérieur, au niveau des fesses, hanches et genoux</li><li>Morpho Concept Technology pour adapter selon la morphologie</li><li>Taille ajustable</li><li>2 hauteurs de poches pour placer les protections CE genoux</li><li>Longueurs de jambes réglables par pressions sur 3 niveaux</li><li>Coupe classique avec un léger délavage et des surpiqures contrastées</li></ul><p><strong>Confort</strong></p><ul><li>Serrage taille par Velcro</li><li>Fermeture par zip et bouton</li><li>Passants pour ceinture</li></ul><p><strong>Caracteristiques</strong></p><ul><li>4 poches</li></ul>;;;;;;En Stock;Disponibilité: Délais sur demande;1;;;1;;0;Couleur:Bleu:1,Genre:Homme:2,Fabricant:Ixon:3,Etanchéité:Non:4,Matière:Textile:5,Saisonnalité:été:6,Ventilé:Non:7;0;new;0;0;0;0;0;0;0;0
81975;1;Pantalon Ixon WHITNEY - Bleu;208,169;202.7777778;1;111.53;1;;15;;;RPGIXPL133043;RPGIXPL133043;Redpoint;Ixon;;;;;;;;0;;;;;;Jean spécifique à la moto pour les femmes, doté de protections genoux CE livrées dans leur pochette filet, il est renforcé en matière tissée sur les fesses, les hanches et les genoux. Pour un confort optimum, il est également doté du Morpho Concept Technology;"<p><strong>Materiaux</strong></p><ul><li>Renforts à l’intérieur, au niveau des fesses, hanches et genoux</li><li>Morpho Concept Technology pour adapter selon la morphologie</li><li>Taille ajustable</li><li>2 hauteurs de poches pour placer les protections CE genoux</li><li>Longueurs de jambes réglables par pressions sur 3 niveaux</li><li>Coupe droite et stylée ; avec détails féminins discrets, finition délavée</li></ul><p><strong>Confort</strong></p><ul><li>Serrage taille par Velcro</li><li>Fermeture par zip et bouton</li><li>Passants pour ceinture</li></ul><p><strong>Caracteristiques</strong></p><ul><li>4 poches</li></ul>";;;;;;En Stock;Disponibilité: Délais sur demande;1;;;1;;0;Couleur:Bleu:1,Genre:Femme:2,Fabricant:Ixon:3,Etanchéité:Non:4,Matière:Textile:5,Saisonnalité:été:6,Ventilé:Non:7;0;new;0;0;0;0;0;0;0;0
81981;1;Pantalon Ixon CLIMBER FLY C-SIZING - ;208,169;249.0740741;1;136.99;1;;15;;;RPGIXPM101011;RPGIXPM101011;Redpoint;Ixon;;;;;;;;0;;;;;;Pantalon sobre tout public au taillant polyvalent. Il est également très complet : étanche, respirant et chaud et connectable.;<p><strong>Materiaux</strong></p><ul><li>Insert étanche et respirant Drymesh</li><li>Doublure hiver amovible intégrale</li></ul><p><strong>Confort</strong></p><ul><li>Serrage taille par élastique</li><li>Fermeture par zip et velcro</li><li>Serrages chevilles par zip et velcro</li></ul><p><strong>Caracteristiques</strong></p><ul><li>3 poches</li><li>Connexion par boucle et pression</li><li>Connexion avec zip au dos</li></ul>;;;;;;En Stock;Disponibilité: Délais sur demande;1;;;1;;0;Couleur::1,Genre:Homme:2,Fabricant:Ixon:3,Etanchéité:Oui:4,Matière:Textile:5,Saisonnalité:Toutes Saisons:6,Ventilé:Non:7;0;new;0;0;0;0;0;0;0;0
81982;1;Pantalon Ixon AMARIS - Noir;208,169;221.2962963;1;121.71;1;;15;;;RPGIXPM111011;RPGIXPM111011;Redpoint;Ixon;;;;;;;;0;;;;;;Ce pantalon technique haut de gamme est très polyvalent d’utilisation car 3 en 1, pour une utilisation en toutes saisons.;<p><strong>Materiaux</strong></p><ul><li>Pantalon convertible 3 en 1</li><li>Étanche et respirant avec insert Drymesh amovible</li><li>Doublure hiver amovible intégrale</li><li>Empiècements en Mesh devant et derrière</li><li>Renforts en Riplan aux genoux</li></ul><p><strong>Confort</strong></p><ul><li>Serrage taille par Velcro</li><li>Fermeture par zip et velcro</li><li>Serrages chevilles par zip et velcro</li></ul><p><strong>Caracteristiques</strong></p><ul><li>4 poches</li><li>Connexion par boucle et pression</li><li>Connexion avec zip au dos</li></ul>;;;;;;En Stock;Disponibilité: Délais sur demande;1;;;1;;0;Couleur:Noir:1,Genre:Femme:2,Fabricant:Ixon:3,Etanchéité:Oui:4,Matière:Textile:5,Saisonnalité:Toutes Saisons:6,Ventilé:Oui:7;0;new;0;0;0;0;0;0;0;0
81983;1;Pantalon Ixon CLIMBER FLY HP - Noir;208,169;175;1;96.25;1;;15;;;RPGIXPM121011;RPGIXPM121011;Redpoint;Ixon;;;;;;;;0;;;;;;Pantalon sobre tout public au taillant polyvalent. Il est également très complet : étanche, respirant et chaud et connectable.;<p><strong>Materiaux</strong></p><ul><li>Insert étanche et respirant Drymesh</li><li>Doublure hiver amovible intégrale</li></ul><p><strong>Confort</strong></p><ul><li>Serrage taille par élastique</li><li>Fermeture par zip et velcro</li><li>Serrages chevilles par zip et velcro</li></ul><p><strong>Caracteristiques</strong></p><ul><li>3 poches</li><li>Connexion par boucle et pression</li><li>Connexion avec zip au dos</li></ul>;;;;;;En Stock;Disponibilité: Délais sur demande;1;;;1;;0;Couleur:Noir:1,Genre:Homme:2,Fabricant:Ixon:3,Etanchéité:Oui:4,Matière:Textile:5,Saisonnalité:Toutes Saisons:6,Ventilé:Non:7;0;new;0;0;0;0;0;0;0;0
