85392;1;Pantalon Ixon CLIMBER FLY C-SIZING - ;461;249.0740741;1;136.99;1;;25;;;RPGIXPM101011;RPGIXPM101011;Redpoint;Ixon;;;;;;;;0;;;;;;Pantalon sobre tout public au taillant polyvalent. Il est également très complet : étanche, respirant et chaud et connectable.;<p><strong>Materiaux</strong></p><ul><li>Insert étanche et respirant Drymesh</li><li>Doublure hiver amovible intégrale</li></ul><p><strong>Confort</strong></p><ul><li>Serrage taille par élastique</li><li>Fermeture par zip et velcro</li><li>Serrages chevilles par zip et velcro</li></ul><p><strong>Caracteristiques</strong></p><ul><li>3 poches</li><li>Connexion par boucle et pression</li><li>Connexion avec zip au dos</li></ul>;;;;;;En Stock;Plus disponible;1;;;1;https://www.motogoodeal.ch/img/import/ixon/200101002-1001.png;1;Couleur::1,Genre:Homme:2,Fabricant:Ixon:3,Etanchéité:Oui:4,Matière:Textile:5,Saisonnalité:Toutes Saisons:6,Ventilé:Non:7;0;new;0;0;0;0;0;0;0;0
85393;1;Pantalon Ixon AMARIS - Noir;461;221.2962963;1;121.71;1;;25;;;RPGIXPM111011;RPGIXPM111011;Redpoint;Ixon;;;;;;;;0;;;;;;Ce pantalon technique haut de gamme est très polyvalent d’utilisation car 3 en 1, pour une utilisation en toutes saisons.;<p><strong>Materiaux</strong></p><ul><li>Pantalon convertible 3 en 1</li><li>Étanche et respirant avec insert Drymesh amovible</li><li>Doublure hiver amovible intégrale</li><li>Empiècements en Mesh devant et derrière</li><li>Renforts en Riplan aux genoux</li></ul><p><strong>Confort</strong></p><ul><li>Serrage taille par Velcro</li><li>Fermeture par zip et velcro</li><li>Serrages chevilles par zip et velcro</li></ul><p><strong>Caracteristiques</strong></p><ul><li>4 poches</li><li>Connexion par boucle et pression</li><li>Connexion avec zip au dos</li></ul>;;;;;;En Stock;Plus disponible;1;;;1;https://www.motogoodeal.ch/img/import/ixon/200102004-1001.png;1;Couleur:Noir:1,Genre:Femme:2,Fabricant:Ixon:3,Etanchéité:Oui:4,Matière:Textile:5,Saisonnalité:Toutes Saisons:6,Ventilé:Oui:7;0;new;0;0;0;0;0;0;0;0
85394;1;Pantalon Ixon CLIMBER FLY HP - Noir;461;175;1;96.25;1;;25;;;RPGIXPM121011;RPGIXPM121011;Redpoint;Ixon;;;;;;;;0;;;;;;Pantalon sobre tout public au taillant polyvalent. Il est également très complet : étanche, respirant et chaud et connectable.;<p><strong>Materiaux</strong></p><ul><li>Insert étanche et respirant Drymesh</li><li>Doublure hiver amovible intégrale</li></ul><p><strong>Confort</strong></p><ul><li>Serrage taille par élastique</li><li>Fermeture par zip et velcro</li><li>Serrages chevilles par zip et velcro</li></ul><p><strong>Caracteristiques</strong></p><ul><li>3 poches</li><li>Connexion par boucle et pression</li><li>Connexion avec zip au dos</li></ul>;;;;;;En Stock;Plus disponible;1;;;1;https://www.motogoodeal.ch/img/import/ixon/200101002-1001.png;1;Couleur:Noir:1,Genre:Homme:2,Fabricant:Ixon:3,Etanchéité:Oui:4,Matière:Textile:5,Saisonnalité:Toutes Saisons:6,Ventilé:Non:7;0;new;0;0;0;0;0;0;0;0
85395;1;Pantalon Ixon LUNA STAR HP - Noir;461;212.037037;1;116.62;1;;25;;;RPGIXPM121012;RPGIXPM121012;Redpoint;Ixon;;;;;;;;0;;;;;;Pantalon femme moderne et sobre. Etanche et respirant, il est aussi très confortable par ses empiècements stretch et sa doublure amovible en coton. Doublure hiver vendue séparément.;<p><strong>Materiaux</strong></p><ul><li>Insert étanche et respirant</li><li>Doublure intérieure coton amovible</li><li>Matière stretch à l’entrejambe</li></ul><p><strong>Confort</strong></p><ul><li>Serrage taille par Velcro</li><li>Fermeture par zip et velcro</li></ul><p><strong>Caracteristiques</strong></p><ul><li>Serrages chevilles par zip et velcro</li><li>2 poches</li></ul>;;;;;;En Stock;Plus disponible;1;;;1;https://www.motogoodeal.ch/img/import/ixon/200102002-1001.png;1;Couleur:Noir:1,Genre:Femme:2,Fabricant:Ixon:3,Etanchéité:Oui:4,Matière:Textile:5,Saisonnalité:Toutes Saisons:6,Ventilé:Non:7;0;new;0;0;0;0;0;0;0;0
85396;1;Pantalon Ixon AMBITIOUS SPORT - Noir;461;230.5555556;1;126.81;1;;25;;;RPGIXPM121013;RPGIXPM121013;Redpoint;Ixon;;;;;;;;0;;;;;;Ce pantalon technique haut de gamme est très polyvalent d’utilisation car 3 en 1 : tandis que de grands panneaux en textile perforé assurent la ventilation, Ambitious Sport dispose d’un insert étanche et respirant amovible et d’une doublure hiver amovible.;<p><strong>Materiaux</strong></p><ul><li>Pantalon convertible 3 en 1</li><li>Insert amovible Drymesh étanche et respirant</li><li>Empiècements en Mesh devant et derrière</li><li>Étanche et respirant avec insert amovible</li><li>Doublure hiver amovible par zip</li><li>Genoux préformés et renforcés en Riplan</li><li>Piping reflectif</li></ul><p><strong>Confort</strong></p><ul><li>Serrage taille par Velcro</li><li>Fermeture par zip et pression</li><li>Serrages chevilles par zip et velcro</li></ul><p><strong>Caracteristiques</strong></p><ul><li>7 poches</li><li>Connexion avec zip 360° autour de la taille</li><li>Connexion par boucle et pression</li></ul>;;;;;;En Stock;Plus disponible;1;;;1;https://www.motogoodeal.ch/img/import/ixon/E4523H-1001.png;1;Couleur:Noir:1,Genre:Homme:2,Fabricant:Ixon:3,Etanchéité:Oui:4,Matière:Textile:5,Saisonnalité:Toutes Saisons:6,Ventilé:Oui:7;0;new;0;0;0;0;0;0;0;0
85397;1;Pantalon Ixon LUNA STAR C-SIZING - ;461;249.0740741;1;136.99;1;;25;;;RPGIXPW081122;RPGIXPW081122;Redpoint;Ixon;;;;;;;;0;;;;;;Pantalon femme moderne et sobre. Etanche et respirant, il est aussi très confortable par ses empiècements stretch et sa doublure amovible en coton. Doublure hiver vendue séparément.;<p><strong>Materiaux</strong></p><ul><li>Insert étanche et respirant</li><li>Doublure intérieure coton amovible</li><li>Matière stretch à l’entrejambe</li></ul><p><strong>Confort</strong></p><ul><li>Serrage taille par Velcro</li><li>Fermeture par zip et velcro</li></ul><p><strong>Caracteristiques</strong></p><ul><li>Serrages chevilles par zip et velcro</li><li>2 poches</li></ul>;;;;;;En Stock;Plus disponible;1;;;1;https://www.motogoodeal.ch/img/import/ixon/200102002-1001.png;1;Couleur::1,Genre:Femme:2,Fabricant:Ixon:3,Etanchéité:Oui:4,Matière:Textile:5,Saisonnalité:Toutes Saisons:6,Ventilé:Non:7;0;new;0;0;0;0;0;0;0;0
85398;1;Pantalon Ixon SHUTTER - Noir;461;91.66666667;1;50.42;1;;20;;;RPGIXPW141011;RPGIXPW141011;Redpoint;Ixon;;;;;;;;0;;;;;;Notre strapline «Creative Bike Wear» représente l’essence même de la marque IXON, sa promesse, son obsession…;<ul><li>En polyester avec enduction PVC</li><li>Zip complet sur le côté des 2 jambes pour une ouverture totale</li><li>Logos et empiècements réflectifs</li><li>Elastique pour maintien sous la chaussure amovible par pression </li></ul>;;;;;;En Stock;Plus disponible;1;;;1;https://www.motogoodeal.ch/img/import/ixon/shutter_noir.jpg,https://www.motogoodeal.ch/img/import/ixon/shutter_200101023_1001_2.jpg;1;Couleur:Noir:1,Genre:Homme:2,Fabricant:Ixon:3,Etanchéité:Non:4,Matière:Textile:5,Saisonnalité:Toutes Saisons:6,Ventilé:Non:7;0;new;0;0;0;0;0;0;0;0
85399;1;Ixon GUARDIAN PROTECTION DORSALE - ;461;26.85185185;1;14.77;1;;20;;;RPGIXSR158081;RPGIXSR158081;Redpoint;Ixon;;;;;;;;0;;;;;;Souple, légère et parfaitement intégrée, la dorsale moto Guardian allie confort et protection et est compatible avec tous les blousons et vestes de la marque Ixon.;<p>Homologuée EPI niveau 1 et CE, elle est très protectrice et résistante à l'abrasion grâce à sa mousse à mémoire de forme permettant une absorption des chocs.</p><p>Avec ses perforations, elle contribue à la respirabilité de votre vêtement. </p><br><p>La dorsale Guardian CE est disponible en 2 tailles : </p><ul><li>S pour tous les blousons et vestes femme (taille XS à M)</li><li>M pour tous les blousons et vestes homme et femme (à partir du L)</li></ul><br><ul><li>Dorsale moto homologuée EPI niveau 1 et CE</li><li>Matière légère</li><li>Souple</li><li>Resistante à l'abrasion : mousse à mémoire de forme permettant une absorption des chocs</li><li>Perforée et très respirante</li></ul>;;;;;;En Stock;Plus disponible;1;;;1;https://www.motogoodeal.ch/img/import/ixon/2474407696487624822f.jpg;1;Genre:Unisex:1,Fabricant:Ixon:2,Matière:Textile:3;0;new;0;0;0;0;0;0;0;0
85400;1;Veste Ixon BROOKLYN HP - Noir;461;313.8888889;1;172.64;1;;25;;;RPGIXVM121011;RPGIXVM121011;Redpoint;Ixon;;;;;;;;0;;;;;;La veste Brooklyn HP est une veste longue qui est à la fois urbaine, sport et chic. Étanche respirante et chaude, ses 4 poches soufflets style baroudeur et ses boucles de serrages finition argent vieilli lui donnent tout son style.;<ul><li>Membrane étanche et respirante</li><li>Doublure hiver amovible </li><li>Col ouatiné amovible</li><li>Col montant avec rehausse néoprène</li><li>Veste longue et droite</li><li>Serrage col, taille et poignets par pression</li><li>Rabat sur zip anti-vent</li><li>Rabat sous zip anti-pluie </li><li>6 poches extérieures</li><li>4 poches intérieures dont 2 sur la doublure</li></ul>;;;;;;En Stock;Plus disponible;1;;;1;https://www.motogoodeal.ch/img/import/ixon/veste-brooklyn-hp.jpg;1;Couleur:Noir:1,Genre:Homme:2,Fabricant:Ixon:3,Etanchéité:Etanche:4,Matière:Textile:5,Saisonnalité:Toutes saisons:6,Ventilé:Non:7,Bosse Aérodynamique:Non:8;0;new;0;0;0;0;0;0;0;0
85401;1;Veste Ixon MONTMARTRE HP - Noir;461;267.5925926;1;147.18;1;;25;;;RPGIXVM121012;RPGIXVM121012;Redpoint;Ixon;;;;;;;;0;;;;;;La veste Montmartre est une veste femme courte, très urbaine, stylée et fonctionnelle, avec ceinture et capuche amovibles. Sa matière souple et ses finitions rappellent tout à fait le prêt à porter, et permettent néanmoins à Montmartre HP de répondre au label IXON Protective Technology et d’être homologué CE avec dorsale CE.;<ul><li>Etanche et respirante </li><li>Doublure hiver amovible intégrale</li><li>Col ouatiné amovible</li><li>Protections CE sur les épaules et les coudes</li><li>Veste courte, cintrée et flex sur les côtés</li><li>Logo et bande réflective au dos</li></ul>;;;;;;En Stock;Plus disponible;1;;;1;https://www.motogoodeal.ch/img/import/ixon/veste-montmartre-hp.jpg;1;Couleur:Noir:1,Genre:Femme:2,Fabricant:Ixon:3,Etanchéité:Etanche:4,Matière:Textile:5,Saisonnalité:Toutes saisons:6,Ventilé:Non:7,Bosse Aérodynamique:Non:8;0;new;0;0;0;0;0;0;0;0
85402;1;Veste Ixon DUNE HP - Noir;461;276.8518519;1;152.27;1;;25;;;RPGIXVM131011;RPGIXVM131011;Redpoint;Ixon;;;;;;;;0;;;;;;Veste 3 en 1 pour toute occassion.;<ul><li>Veste convertible 3 en 1</li><li>Construction en Noxiguard avec renforts en Riplan aux épaules</li><li>Protections coudes et épaules homologuées CE</li><li>Dorsale homologuée CE</li><li>Insert Drymesh étanche et respirant, amovible</li><li>Doublure hiver chaude, amovible</li><li>Air Flow Process : Grille de ventilation permanente sur les manches et dans le dos</li><li>Flap de ventilation rabattables sur la poitrine</li><li>Col doublé micropeach avec rehausse néoprène</li><li>Serrage par velcro aux poignets</li><li>Réglage par ceinture élastique à la taille</li><li>Serrage anti gonflement par velcro aux biceps</li><li>Grand zip de raccord pantalon</li><li>Veste certifiée CE</li></ul>;;;;;;En Stock;Plus disponible;1;;;1;https://www.motogoodeal.ch/img/import/ixon/105101017-1001-3.jpg,https://www.motogoodeal.ch/img/import/ixon/105101017-1001-2.jpg;1;Couleur:Noir:1,Genre:Homme:2,Fabricant:Ixon:3,Etanchéité:Etanche:4,Matière:Textile:5,Saisonnalité:Toutes saisons:6,Ventilé:Non:7,Bosse Aérodynamique:Non:8;0;new;0;0;0;0;0;0;0;0
85403;1;Veste Ixon KALIA SHELL HP - Noir;461;286.1111111;1;157.36;1;;25;;;RPGIXVM131012;RPGIXVM131012;Redpoint;Ixon;;;;;;;;0;;;;;;Blouson femme textile très technique pour l’hiver : mélange de matières Noxiguard pour la résistance et NoxiShell pour le confort et la protection contre le vent, sa doublure chaude amovible est exclusive car également portable en doudoune sportswear très sympa. Ce blouson est certifié CE avec dorsale CE,;<p><strong>Materiaux</strong></p><ul><li>Noxishell sur le devant pour une parfaite barrière anti-vent</li><li>Insert étanche et respirant Drymesh</li><li>Doublure hiver amovible intégrale portable en doudoune</li><li>Flex sur les côtés</li><li>Taille élastiquée au dos</li></ul><p><strong>Confort</strong></p><ul><li>Col haut</li><li>Serrage col par velcro</li><li>Serrages poignets par velcro</li><li>Serrage taille par élastique et boucle</li><li>Rabat sous zip frontal</li><li>Rabat sur zip frontal</li></ul><p><strong>Caracteristiques</strong></p><ul><li>2 poches extérieures</li><li>4 poches doublure</li><li>2 poches intérieures</li><li>Connexion avec zip au dos</li><li>Connexion par boucle et pression</li></ul>;;;;;;En Stock;Plus disponible;1;;;1;https://www.motogoodeal.ch/img/import/ixon/105102005-1001.png;1;Couleur:Noir:1,Genre:Femme:2,Fabricant:Ixon:3,Etanchéité:Etanche:4,Matière:Textile:5,Saisonnalité:Toutes saisons:6,Ventilé:Non:7,Bosse Aérodynamique:Non:8;0;new;0;0;0;0;0;0;0;0
85404;1;Veste Ixon OTTAWA - Noir;461;387.962963;1;213.38;1;;25;;;RPGIXVM151012;RPGIXVM151012;Redpoint;Ixon;;;;;;;;0;;;;;;Cette veste ¾ typée parka « reporter » est très couvrante, très chaude et très confortable.;<p><strong>Materiaux</strong></p><ul><li>Veste 3/4, couvrante et très chaude</li><li>Matière Noxitech Canvas + très souple</li><li>Etanche et respirante avec insert Drymesh intégré</li><li>Doublure hiver amovible chaude avec poignets bords côte</li><li>Col ouatiné chaud amovible</li><li>Capuche amovible par zip avec fourrure amovible par zip</li><li>Finitions cuir au col, poignets et poches</li><li>Pattes pressionnées stylées avec galons de finition</li></ul><p><strong>Confort</strong></p><ul><li>Col classique</li><li>Serrages poignets par pression</li><li>Serrage taille par lien coulissant intérieur et patte pressionnée au dos</li><li>Soufflets d’aisance latéraux zippés</li><li>Rabat sous zip frontal</li><li>Rabat sur zip frontal</li></ul><p><strong>Caracteristiques</strong></p><ul><li>5 poches extérieures</li><li>1 poche portefeuille étanche</li><li>2 poches doublure</li><li>2 poches intérieures</li></ul>;;;;;;En Stock;Plus disponible;1;;;1;https://www.motogoodeal.ch/img/import/ixon/105101024-1001.png;1;Couleur:Noir:1,Genre:Homme:2,Fabricant:Ixon:3,Etanchéité:Etanche:4,Matière:Textile:5,Saisonnalité:Toutes saisons:6,Ventilé:Non:7,Bosse Aérodynamique:Non:8;0;new;0;0;0;0;0;0;0;0
85405;1;Veste Ixon OTTAWA LADY - Noir;461;387.962963;1;213.38;1;;25;;;RPGIXVM151014;RPGIXVM151014;Redpoint;Ixon;;;;;;;;0;;;;;;Déclinaison du modèle Ottawa pour femmes, cette veste reprend toutes les caractéristiques qui ont fait son succès : doublure hiver très chaude, grande capuche avec bord fourrure hyper stylé, col hiver ouatiné amovible, finitions façons cuir;<p><strong>Materiaux</strong></p><ul><li>Veste 3/4, couvrante et très chaude</li><li>Matière Noxitech Canvas + très souple</li><li>Etanche et respirante avec insert Drymesh intégré</li><li>Doublure hiver amovible chaude avec poignets bords côte</li><li>Col ouatiné chaud amovible</li><li>Capuche amovible par zip avec fourrure amovible par zip</li><li>Finitions cuir au col, poignets et poches</li><li>Pattes pressionnées stylées avec galons de finition</li></ul><p><strong>Confort</strong></p><ul><li>Col classique</li><li>Serrages poignets par pression</li><li>Serrage taille par lien coulissant intérieur et patte pressionnée au dos</li><li>Soufflets d’aisance latéraux zippés</li><li>Rabat sous zip frontal</li><li>Rabat sur zip frontal</li></ul><p><strong>Caracteristiques</strong></p><ul><li>5 poches extérieures</li><li>1 poche portefeuille étanche</li><li>2 poches doublure</li><li>2 poches intérieures</li></ul>;;;;;;En Stock;Plus disponible;1;;;1;https://www.motogoodeal.ch/img/import/ixon/105102016-1001.png;1;Couleur:Noir:1,Genre:Homme:2,Fabricant:Ixon:3,Etanchéité:Etanche:4,Matière:Textile:5,Saisonnalité:Toutes saisons:6,Ventilé:Non:7,Bosse Aérodynamique:Non:8;0;new;0;0;0;0;0;0;0;0
85406;1;Veste Ixon PROTOUR HP - Noir/Jaune-Vif;461;360.1851852;1;198.10;1;;25;;;RPGIXVM151722;RPGIXVM151722;Redpoint;Ixon;;;;;;;;0;;;;;;"Nouveau modèle 3 en 1, Protour HP est également l’un des vestes les plus chaudes de la gamme. Ses caractéristiques haut de gamme et ses fonctionnalités la rendent très complète. La veste extérieure est équipée de multiples serrages de nombreuses poches et de grandes ventilations modulables par zip ; l’insert étanche et respirant est amovible par zip, et la doublure hiver est également amovible et très chaude grâce à sa ouatine façon doudoune, très épaisse et aérée.";"<p><strong>Materiaux</strong></p><ul><li>Veste 3 en 1 à la fois ventilée, étanche et très chaude</li><li>Insert amovible étanche et respirant Drymesh</li><li>Doublure hiver très chaude amovible par zip</li><li>Grandes ventilations zippées sur la poitrine, le dos et les manches</li><li>Nombreuses poches</li></ul><p><strong>Confort</strong></p><ul><li>Col classique</li><li>Rehausse col néoprène et mentonnière</li><li>Serrages poignets par patte velcro</li><li>Serrage col par velcro</li><li>Serrage poitrine par élastique (AUTOFIT)</li><li>Serrage taille par élastique et double boucle</li><li>Serrage biceps par élastique et pression</li><li>Rabat sous zip central</li><li>Double rabat sur zip central</li></ul><p><strong>Caracteristiques</strong></p><ul><li>Double rabat sur zip central</li><li>2 poches mains zippées</li><li>2 poches plaquées avec rabat dont une étanche</li><li>2 grandes ouvertures zippées à la poitrine pouvant servir de poche ou de ventilation</li><li>2 ouvertures zippées aux avant-bras pouvant servir de poche ou de ventilation</li><li>2 poches doublures</li><li>2 poches intérieures</li><li>1 poche portefeuille étanche</li><li>Connexion par zip 360° autour de la taille<br><iframe width=""560"" height=""315"" src=""https://www.youtube.com/embed/YWj4Hrgv4hM?controls=0&amp;showinfo=0"" frameborder=""0"" allowfullscreen></iframe>";;;;;;En Stock;Plus disponible;1;;;1;https://www.motogoodeal.ch/img/import/ixon/105101027-1072.png;1;Couleur:Noir/Jaune-Vif:1,Genre:Homme:2,Fabricant:Ixon:3,Etanchéité:Etanche:4,Matière:Textile:5,Saisonnalité:Toutes saisons:6,Ventilé:Oui:7,Bosse Aérodynamique:Non:8;0;new;0;0;0;0;0;0;0;0
85407;1;Veste Ixon OTTAWA - Bleu;461;387.962963;1;213.38;1;;25;;;RPGIXVM153041;RPGIXVM153041;Redpoint;Ixon;;;;;;;;0;;;;;;Cette veste ¾ typée parka « reporter » est très couvrante, très chaude et très confortable.;<p><strong>Materiaux</strong></p><ul><li>Veste 3/4, couvrante et très chaude</li><li>Matière Noxitech Canvas + très souple</li><li>Etanche et respirante avec insert Drymesh intégré</li><li>Doublure hiver amovible chaude avec poignets bords côte</li><li>Col ouatiné chaud amovible</li><li>Capuche amovible par zip avec fourrure amovible par zip</li><li>Finitions cuir au col, poignets et poches</li><li>Pattes pressionnées stylées avec galons de finition</li></ul><p><strong>Confort</strong></p><ul><li>Col classique</li><li>Serrages poignets par pression</li><li>Serrage taille par lien coulissant intérieur et patte pressionnée au dos</li><li>Soufflets d’aisance latéraux zippés</li><li>Rabat sous zip frontal</li><li>Rabat sur zip frontal</li></ul><p><strong>Caracteristiques</strong></p><ul><li>5 poches extérieures</li><li>1 poche portefeuille étanche</li><li>2 poches doublure</li><li>2 poches intérieures</li></ul>;;;;;;En Stock;Plus disponible;1;;;1;https://www.motogoodeal.ch/img/import/ixon/105101024-3004.png;1;Couleur:Bleu:1,Genre:Homme:2,Fabricant:Ixon:3,Etanchéité:Etanche:4,Matière:Textile:5,Saisonnalité:Toutes saisons:6,Ventilé:Non:7,Bosse Aérodynamique:Non:8;0;new;0;0;0;0;0;0;0;0
85408;1;Veste Ixon WALLSTREET - Noir;461;415.7407407;1;228.66;1;;25;;;RPGIXVW111011;RPGIXVW111011;Redpoint;Ixon;;;;;;;;0;;;;;;Cette veste urbaine haut de gamme se distingue avant tout par sa matière très performante, à la fois résistante, 100% étanche et extrêmement respirante. Elle est également très chaude avec capuche amovible.;<p><strong>Materiaux</strong></p><ul><li>Etanche et très respirante avec insert Skintech</li><li>Doublure hiver amovible intégrale</li><li>Capuche amovible avec bord fourrure amovible</li></ul><p><strong>Confort</strong></p><ul><li>Col haut</li><li>Serrage col par pression</li><li>Serrages poignets par pression</li><li>Serrage bas de blouson par zip</li><li>Rabat sur zip frontal</li></ul><p><strong>Caracteristiques</strong></p><ul><li>2 poches extérieures</li><li>1 poche étanche</li><li>3 poches mobile</li><li>2 poches doublure</li><li>2 poches intérieures</li></ul>;;;;;;En Stock;Plus disponible;1;;;1;https://www.motogoodeal.ch/img/import/ixon/105101007-1001.png;1;Couleur:Noir:1,Genre:Homme:2,Fabricant:Ixon:3,Etanchéité:Etanche:4,Matière:Textile:5,Saisonnalité:Toutes saisons:6,Ventilé:Non:7,Bosse Aérodynamique:Non:8;0;new;0;0;0;0;0;0;0;0
;;;;;;;;;;;;;;;;;;;;;;;;;;;;;;;;;;;;;;;;;;;;;;;;;;;;;;
;;;;;;;;;;;;;;;;;;;;;;;;;;;;;;;;;;;;;;;;;;;;;;;;;;;;;;
;;;;;;;;;;;;;;;;;;;;;;;;;;;;;;;;;;;;;;;;;;;;;;;;;;;;;;
;;;;;;;;;;;;;;;;;;;;;;;;;;;;;;;;;;;;;;;;;;;;;;;;;;;;;;
;;;;;;;;;;;;;;;;;;;;;;;;;;;;;;;;;;;;;;;;;;;;;;;;;;;;;;
;;;;;;;;;;;;;;;;;;;;;;;;;;;;;;;;;;;;;;;;;;;;;;;;;;;;;;
;;;;;;;;;;;;;;;;;;;;;;;;;;;;;;;;;;;;;;;;;;;;;;;;;;;;;;
;;;;;;;;;;;;;;;;;;;;;;;;;;;;;;;;;;;;;;;;;;;;;;;;;;;;;;
;;;;;;;;;;;;;;;;;;;;;;;;;;;;;;;;;;;;;;;;;;;;;;;;;;;;;;
;;;;;;;;;;;;;;;;;;;;;;;;;;;;;;;;;;;;;;;;;;;;;;;;;;;;;;
;;;;;;;;;;;;;;;;;;;;;;;;;;;;;;;;;;;;;;;;;;;;;;;;;;;;;;
;;;;;;;;;;;;;;;;;;;;;;;;;;;;;;;;;;;;;;;;;;;;;;;;;;;;;;
;;;;;;;;;;;;;;;;;;;;;;;;;;;;;;;;;;;;;;;;;;;;;;;;;;;;;;
;;;;;;;;;;;;;;;;;;;;;;;;;;;;;;;;;;;;;;;;;;;;;;;;;;;;;;
;;;;;;;;;;;;;;;;;;;;;;;;;;;;;;;;;;;;;;;;;;;;;;;;;;;;;;
