85246;;Alpinestars Schuhe FASTER WP - Schwarz/Grau;;;;;;;;;;RPGASCR151101;;;;;;;;;;;;;;;;;Äußerst leicht und aggressiv gestylt ist der Faster Waterproof Schuh für verbesserte Straßen-Fahrleistung anatomisch geschnitten. Der Sohleaufbau des Faster bietet Flexibilität und Strukturintegrität, während die Hauptstruktur aus technischer Mikrofaser Strapazierfähigkeit und Abriebfestigkeit leistet. Mit einer leistungsstarken Polsterung, 3D Mesh und hochentwickeltem Textilfutter ist der Faster Waterproof dazu sehr komfortabel.;"<ul><li>Aggressiv-geschnittenes Obermaterial aus extrem-leichter strapazierfähiger und abriebfester Mikrofaser.</li><li>Wasserfeste Membran unter dem Obermaterial für nachgewiesene Leistung bei schwieriger Witterung.</li><li>Äußerst leichte Gummisohle mit Laser-abgetragener strukturierter Griffigkeit, überzogen mit PU Zwischensohle für Komfort, und eingebautem Stahlschienbein für erhöhte Sohlesteifigkeit.</li><li>Die leistungsstarke Polsterung im Zunge- und Kragenbereich bietet hohe Komfortniveaus und Passgenauigkeit um das Fußgelenk und Rist herum.</li><li>Flexeinsätze an Achillesferse bieten Fahrkomfort und Beweglichkeit sowohl beim Motorrad-Fahren als auch beim Gehen.</li><li>Innere Zehen- und Fersenkappe sind unter dem Obermaterial für Dauerhaftigkeit, verbessertes Fahrgefühl und Leistung geschichtet.</li><li>Das herausnehmbare und austauschbare Fußbett aus EVA und Lycra® ist für zusätzlichen Komfort und Stütze anatomisch-geschnitten.</li><li>Höchst atmungsaktives Mesh-Futter an Waden und Zunge für verbesserten Komfort.</li><li>Das hochentwickelte Textilfutter zeichnet sich durch Mikrofaser-Wildleder Einsätze an die Ferse zur Verhinderung des Rutschens im Schuh aus.</li><li>Reflektierende Warn-Einsätze am Rückenteil verbessern Sichtbarkeit für anderen Verkehrsteilnehmer.</li><li>Sicherer personalisierter Verschluss dank des Schnürsystem und der einstellbaren Klettverschluss-Lasche über den unteren Bereich des Schienbeins.</li><li>Klettverschluss-Laschen weisen PU-Spitzen für Griffigkeit und mühelosen Verschließung auf.</li><li>Double-Density TPU Knöchelschutz-Platten sind unter dem Obermaterial beschichtet und mit Polyschaum-Polsterung verstärkt.</li><li>Äußerer TPR Zehenschleifer und Knöchelschutz schützen gegen Abrieb und Stöße.</li><li>Schaltkissen mit geprägter strukturierter Textur für zusätzliche Griffigkeit sind mit Polyschaum-Polsterung für Komfort verstärkt.</li></ul><br><iframe width=""560"" height=""315"" src=""https://www.youtube.com/embed/KNkJ0_Aw0wQ?controls=0&amp;showinfo=0"" frameborder=""0"" allowfullscreen></iframe>";;Alpinestars Schuhe FASTER WP - Schwarz/Grau Motogoodeal - Motorradspezialist;;Alpinestars Schlussverkauf - Die besten Preise der Saison!;;Auf Lager;Ausverkauft;;;;;;;;;;;;;;;;;
85247;;Alpinestars Schuhe SP-1 - Schwarz/Weiss/Rot/Gelb;;;;;;;;;;RPGASCR151231;;;;;;;;;;;;;;;;;Als ein aggressiv-geschnittener Stiefel für die Straßenfahrt ist die SP-1 aus federleichter Mikrofaser angefertigt und integriert erstklassige Schutzeigenschaften. Mit einem durchgehenden Textil-Futter und -Polsterung ist dieser Stiefel äußerst komfortabel und fördert zugleich eine genaue Passform. Seine einzigartige Gummimischung bietet ausgezeichnete Griffigkeit beim jeden Wetter für die ultimative Präzisionssteuerung.;<ul><li>Aus federleichter strapazierfähiger und abriebfester Mikrofaser mit vorderen und hinteren Akkordeon- Einsätze für Stütze und Komfort.</li><li>Schnellschnürsystem mit Kevlar® sowie verstellbarer Klettverschluss-Streifen für personalisierten und sicheren Verschluss.</li><li>Äußerer TPR Zehenschleifer und äußerer Knöchelschutz schützen gegen Abrieb und Stöße.</li><li>TPU Schaltkissen für Sensibilität am Motorradsteuer ebenso wie Strapazierfähigkeit.</li><li>Äußere hoch modul TPU Fersenkappe für verbesserten Aufprallschutz und Strapazierfähigkeit.</li><li>Double-Density Knöchelprotektor auf der medialen Seite ist unter dem Obermaterial geschichtet und bietet Schutzleistung und Abriebfestigkeit in den Schlüsselbereichen.</li><li>Innerer Zehenkappenschutz ist unter dem Obermaterial für Strapazierfähigkeit, verbessertes Gefühl und Leistung geschichtet.</li><li>Sohle aus Alpinestars einzigartige Gummimischung fördert verbessertes Gefühl und Griff, Wasserableitung und Strapazierfähigkeit.</li><li>Atmungsaktives Textil-Innenfutter zeichnet sich durch Antirutsch-Verstärkung aus Wildleder im Fersebereich auf, um den Fuß in die richtige Position beim Fahren zu halten.</li><li>Innere Polsterung an Zunge, Waden und rund um das Sprunggelenk leistet Komfort und genaue Passform.</li><li>Innere Zwischensohle aus hochwertigem Modul-Polyamid mit eingebauten Schienbeinverstärkungen für Struktur und Stütze im Fußgewölbebereich.</li><li>Äußerst sichtbarer Einsatz im Achillesferse-Bereich für verbesserte Sichtbarkeit.</li><li>Herausnehmbares anatomisches Fußbett mit EVA-Schaum und Lycra® für Annehmlichkeit, Komfort und Stütze.</li><li>Der SP-1 Stiefel ist zertifiziert nach den Standards ( 89/686/EEC – KAT 2).</li></ul>;;Alpinestars Schuhe SP-1 - Schwarz/Weiss/Rot/Gelb Motogoodeal - Motorradspezialist;;Alpinestars Schlussverkauf - Die besten Preise der Saison!;;Auf Lager;Ausverkauft;;;;;;;;;;;;;;;;;
85248;;Alpinestars Schuhe FASTER WP - Schwarz/Grau/Neongelb;;;;;;;;;;RPGASCR151551;;;;;;;;;;;;;;;;;Äußerst leicht und aggressiv gestylt ist der Faster Waterproof Schuh für verbesserte Straßen-Fahrleistung anatomisch geschnitten. Der Sohleaufbau des Faster bietet Flexibilität und Strukturintegrität, während die Hauptstruktur aus technischer Mikrofaser Strapazierfähigkeit und Abriebfestigkeit leistet. Mit einer leistungsstarken Polsterung, 3D Mesh und hochentwickeltem Textilfutter ist der Faster Waterproof dazu sehr komfortabel.;"<ul><li>Aggressiv-geschnittenes Obermaterial aus extrem-leichter strapazierfähiger und abriebfester Mikrofaser.</li><li>Wasserfeste Membran unter dem Obermaterial für nachgewiesene Leistung bei schwieriger Witterung.</li><li>Äußerst leichte Gummisohle mit Laser-abgetragener strukturierter Griffigkeit, überzogen mit PU Zwischensohle für Komfort, und eingebautem Stahlschienbein für erhöhte Sohlesteifigkeit.</li><li>Die leistungsstarke Polsterung im Zunge- und Kragenbereich bietet hohe Komfortniveaus und Passgenauigkeit um das Fußgelenk und Rist herum.</li><li>Flexeinsätze an Achillesferse bieten Fahrkomfort und Beweglichkeit sowohl beim Motorrad-Fahren als auch beim Gehen.</li><li>Innere Zehen- und Fersenkappe sind unter dem Obermaterial für Dauerhaftigkeit, verbessertes Fahrgefühl und Leistung geschichtet.</li><li>Das herausnehmbare und austauschbare Fußbett aus EVA und Lycra® ist für zusätzlichen Komfort und Stütze anatomisch-geschnitten.</li><li>Höchst atmungsaktives Mesh-Futter an Waden und Zunge für verbesserten Komfort.</li><li>Das hochentwickelte Textilfutter zeichnet sich durch Mikrofaser-Wildleder Einsätze an die Ferse zur Verhinderung des Rutschens im Schuh aus.</li><li>Reflektierende Warn-Einsätze am Rückenteil verbessern Sichtbarkeit für anderen Verkehrsteilnehmer.</li><li>Sicherer personalisierter Verschluss dank des Schnürsystem und der einstellbaren Klettverschluss-Lasche über den unteren Bereich des Schienbeins.</li><li>Klettverschluss-Laschen weisen PU-Spitzen für Griffigkeit und mühelosen Verschließung auf.</li><li>Double-Density TPU Knöchelschutz-Platten sind unter dem Obermaterial beschichtet und mit Polyschaum-Polsterung verstärkt.</li><li>Äußerer TPR Zehenschleifer und Knöchelschutz schützen gegen Abrieb und Stöße.</li><li>Schaltkissen mit geprägter strukturierter Textur für zusätzliche Griffigkeit sind mit Polyschaum-Polsterung für Komfort verstärkt.</li></ul><br><iframe width=""560"" height=""315"" src=""https://www.youtube.com/embed/KNkJ0_Aw0wQ?controls=0&amp;showinfo=0"" frameborder=""0"" allowfullscreen></iframe>";;Alpinestars Schuhe FASTER WP - Schwarz/Grau/Neongelb Motogoodeal - Motorradspezialist;;Alpinestars Schlussverkauf - Die besten Preise der Saison!;;Auf Lager;Ausverkauft;;;;;;;;;;;;;;;;;
85249;;Alpinestars Schuhe J-6 WP - Braun;;;;;;;;;;RPGASCR15801;;;;;;;;;;;;;;;;;Der höchst komfortable leichte Street-styled J-6 Schuh zeichnet sich durch einen ergonomischen MX-abgeleiteten Sprunggelenkschutz zur Schutz der Schlüsselbereichen auf und ist aus Vollnarbenleder und Wildleder angefertigt. Er integriert eine 100% wasserfeste Membran für außerordentliche Wetterschutz-Niveaus.;<ul><li>Leichtes Street-styled Obermaterial aus Vollnarbenleder und Wildleder für optimalen Komfort, Strapazierfähigkeit und Auftritt.</li><li>Die wasserfeste Membran ist im Chassis für 100% Dichtigkeit gegenüber dem Wassereindringen auf raffinierte Weise integriert.</li><li>Zungenoberteil- und Kragenaufbau aus Leder für verbesserten Komfort, Strapazierfähigkeit und luxuriösen Tragkomfort.</li><li>Schnürsystem mit Metallösen am Rist für einfache feste und komfortable Passgenauigkeit.</li><li>Der doppeldichtige und ergonomische Motocross-abgeleitete Fußgelenk- und Ferse-Schutz ist zwischen das Obermaterial und das gepolsterte Futter und sorgt für strategischen Rundum-Schutz und Flexibilität in Schlüsselbereichen.</li><li>Die Polsterung im Zunge- und Fersebereich bietet hohe Komfortniveaus und Passgenauigkeit um dem Fußgelenk und Rist herum.</li><li>Sohlenaufbau aus hochentwickelter Gummimischung ist an der Decksohle für Stabilität, Griffigkeit, Stütze und Strapazierfähigkeit gemoldet.</li><li>Verstärkte Mittelsohle zwischen die Decksohle und Sohle für Gestaltfestigkeit und Strapazierfähigkeit.</li><li>Das herausnehmbare und austauschbare Fußbett aus EVA und Lycra® ist für zusätzlichen Komfort und Stütze anatomisch-geschnitten.</li><li>Metalllogo, Verzierungen und Muster verleihen diesem Stiefel ein modisches Design.</li><li>Die innere Zehenkappe- und Fersenkappe-Verstärkung wird unter das Obermaterial für ein ergonomischeres Design geschichtet.</li></ul>;;Alpinestars Schuhe J-6 WP - Braun Motogoodeal - Motorradspezialist;;Alpinestars Schlussverkauf - Die besten Preise der Saison!;;Auf Lager;Ausverkauft;;;;;;;;;;;;;;;;;
85250;;Alpinestars Handschuhe SMX-2 AIR CARBON - Schwarz;;;;;;;;;;RPGASGA14101;;;;;;;;;;;;;;;;;Mit seinem Knöchelschützer aus Kohlefaser und der Außenhaut-Anfertigung aus 3D Mesh-Textil und Leder leistet der SMX-2 Air Carbon ausgezeichnete Schutzniveaus und Kühl-Luftführung für jene heißen Sommertagen ins Verkehrschaos.;<ul><li>Strapazierfähige mehrschichtige Außenhaut-Anfertigung integriert synthetisches Wildleder und 3D Mesh für Strapazierfähigkeit, Abriebfestigkeit und höchstmögliche Atmungsaktivität.</li><li>Kunstleder-Verstärkungen auf dem Handteller, den Fingern und der Aufprallflächen bieten maximale Abriebfestigkeit an kritischen Aufprallstellen.</li></ul><br><p><strong>Schutz-Innovation</p></strong><ul><li>Alpinestars ergonomisch gestaltete bahnbrechende Knöchelschützer aus Kohlefaser bieten außergewöhnlichen Aufprall- und Abriebschutz.</li><li>Fingerspitze und Handrücken integrieren TPR Einsätze für zusätzlichen Aufprall- und Abriebschutz in den kritischen Bereichen.  </li><li>Stoßdämpfende EVA-Schaum Einsätze am Daumen für zusätzliche Aufprallleistung.</li></ul><br><p><strong>Komfort & Kontrolle</p></strong><ul><li>Fingeroberfläche und Daumen aus 3D Mesh-Textil für Kühlungsleistung.  </li><li>Anatomisch vorgeformter Fingeraufbau zur Verringerung der Fahrermüdung.</li><li>Handgelenkmanschette aus Neoprene sowie Klett- und TPR-Verschluss für einen festen und personalisierten Verschluss.   </li><li>Touchscreen kompatible Zeigefingerspitze und Daumen</li></ul><br><p><strong>Material:</p></strong><ul><li>38%SYNTHETISCHES WILDLEDER</li><li>28%LEDER</li><li>15%POLYAMIDE</li><li>5%POLYESTER</li><li>5%CARBON FIBER</li><li>3%Elasthan</li><li>3%POLYURETHANE</li><li>3%NEOPRENE</li></ul><br><p><strong>Futter:</p></strong><ul><li>100%POLYESTER</li></ul>;;Alpinestars Handschuhe SMX-2 AIR CARBON - Schwarz Motogoodeal - Motorradspezialist;;Alpinestars Schlussverkauf - Die besten Preise der Saison!;;Auf Lager;Ausverkauft;;;;;;;;;;;;;;;;;
85251;;Alpinestars Handschuhe SMX-2 AIR CARBON - Schwarz/Rot;;;;;;;;;;RPGASGA14311;;;;;;;;;;;;;;;;;Mit seinem Knöchelschützer aus Kohlefaser und der Außenhaut-Anfertigung aus 3D Mesh-Textil und Leder leistet der SMX-2 Air Carbon ausgezeichnete Schutzniveaus und Kühl-Luftführung für jene heißen Sommertagen ins Verkehrschaos.;<ul><li>Strapazierfähige mehrschichtige Außenhaut-Anfertigung integriert synthetisches Wildleder und 3D Mesh für Strapazierfähigkeit, Abriebfestigkeit und höchstmögliche Atmungsaktivität.</li><li>Kunstleder-Verstärkungen auf dem Handteller, den Fingern und der Aufprallflächen bieten maximale Abriebfestigkeit an kritischen Aufprallstellen.</li></ul><br><p><strong>Schutz-Innovation</p></strong><ul><li>Alpinestars ergonomisch gestaltete bahnbrechende Knöchelschützer aus Kohlefaser bieten außergewöhnlichen Aufprall- und Abriebschutz.</li><li>Fingerspitze und Handrücken integrieren TPR Einsätze für zusätzlichen Aufprall- und Abriebschutz in den kritischen Bereichen.  </li><li>Stoßdämpfende EVA-Schaum Einsätze am Daumen für zusätzliche Aufprallleistung.</li></ul><br><p><strong>Komfort & Kontrolle</p></strong><ul><li>Fingeroberfläche und Daumen aus 3D Mesh-Textil für Kühlungsleistung.  </li><li>Anatomisch vorgeformter Fingeraufbau zur Verringerung der Fahrermüdung.</li><li>Handgelenkmanschette aus Neoprene sowie Klett- und TPR-Verschluss für einen festen und personalisierten Verschluss.   </li><li>Touchscreen kompatible Zeigefingerspitze und Daumen</li></ul><br><p><strong>Material:</p></strong><ul><li>38%SYNTHETISCHES WILDLEDER</li><li>28%LEDER</li><li>15%POLYAMIDE</li><li>5%POLYESTER</li><li>5%CARBON FIBER</li><li>3%Elasthan</li><li>3%POLYURETHANE</li><li>3%NEOPRENE</li></ul><br><p><strong>Futter:</p></strong><ul><li>100%POLYESTER</li></ul>;;Alpinestars Handschuhe SMX-2 AIR CARBON - Schwarz/Rot Motogoodeal - Motorradspezialist;;Alpinestars Schlussverkauf - Die besten Preise der Saison!;;Auf Lager;Ausverkauft;;;;;;;;;;;;;;;;;
85252;;Alpinestars Handschuhe MUSTANG - Schwarz/Weiss;;;;;;;;;;RPGASGL10121;;;;;;;;;;;;;;;;;Aus perforiertem Ziegenleder, mit modisch kurzer Manschettenpartie und bequemem Innenfutter. Der Sommer-Handschuh Mustang ist für den Straßenmotorradfahrer, der Tragekomfort und optimalen Schutz sucht.;<p><strong>Material:</p></strong><ul><li>Handrücken aus perforiertem Ziegenleder.</li><li>Handfläche aus Ziegenleder mit Verstärkung aus Kunstveloursleder.</li><li>Die PU-Panels auf der Handschuhoberseite verleihen ihm ein glanzvolles Aussehen.</li></ul><br><p><strong>Sicherheit:</p></strong><ul><li>PU-Schaumpolsterung als Knöchelschutz, verkleidet mit PU-Kunststoff.</li><li>4 mm EVA-Schaumpolsterung auf Ober- und Seitenteil, Finger und Daumen des Handschuhs für mehr Schutz und bessere Haftfähigkeit.</li></ul><br><p><strong>Komfort:</p></strong><ul><li>Vorgeformte Finger für weniger Ermüdung des Fahrers und mehr Fahrkomfort.</li><li>Die elastischen Falteinlagen aus Ziegenleder an den Fingern und Daumen machen den Handschuh elastischer, optimieren den Komfort, geben mehr Halt und verbessern die Sensibilität für Schaltbefehle.</li><li>Vielschichtige Handfläche für eine personalisierte Passform.</li><li>Handgelenkverschluss mit D-Ringen und Riemen mit expansibler Lycra-Membran für ein einfaches An- und Ausziehen.</li><li>Farben: Schwarz-Weiss, Schwarz-Grau, Sand-Braun</li></ul><br><p><strong>Material</p></strong><ul><li>78% LEDER</li><li>19% Kunstleder</li><li>3% POLYESTER</li></ul><br><p><strong>Futter: </p></strong><ul><li>100%POLYESTER</li></ul>;;Alpinestars Handschuhe MUSTANG - Schwarz/Weiss Motogoodeal - Motorradspezialist;;Alpinestars Schlussverkauf - Die besten Preise der Saison!;;Auf Lager;Ausverkauft;;;;;;;;;;;;;;;;;
85253;;Alpinestars Handschuhe GPX - Integralschwarz;;;;;;;;;;RPGASGL13101;;;;;;;;;;;;;;;;;Mit Alpinestars Strecke-getestetem fortschrittlichem Knöchel-Protektorsystem integriert der GPX Handschuh innovative Eigenschaften wie die patentierte Fingerbrücke und verstärkte Leder-Fingernähte für ausgezeichnete Abriebfestigkeit ebenso wie einen anatomisch vorgeformten Fingerschnitt zur Erhöhung des Fahrkomforts und Verringerung der Materialermüdung.;<p><strong>Anfertigung:</p></strong><ul><li>Dieser technisch konstruierte Handschuh integriert Leder, Wildleder und perforierte Ledereinsätze für Komfort und Atmungsaktivität.</li><li>Eingebaute Akkordeon-Stretcheinsätze aus Leder im ersten drei Fingern und Daumen für uneingeschränkte Beweglichkeit.  </li><li>Das kurze Bündchendesign zeichnet sich durch erweiterte gepolsterte Bund zur Deckung des Handgelenk-Außenbereiches.</li></ul><br><p><strong>Schutz</p></strong><ul><li>Alpinestars Strecke-getestetes Dual-Density Polymer Knöchel-Schutzsystem fördert die Belüftung und ist für eine überragende Aufprall- und Abriebleistung strukturiert. Das innovative offene Rücken-Design zeichnet sich durch ein perforiertes Oberpaneel für guten Bewegungsumfang aus.  </li><li>Die zusammengesetzten TPU Schleifer im kleinen Finger und Handballen sind auf hinterschäumte Lederpaneele für Komfort und Leistung angebracht.</li><li>Die patentierte dritte und vierte Fingerbrücke verhindert Abtrennung der Fingern und begrenzt Fingerverdrehung und geplatzte Nähte.  </li><li>Perforierte Polyschaum-Polsterung am Daumen, Bündchen und den Fingern.</li></ul><br><p><strong>Komfort</p></strong><ul><li>Leder-verstärkte Fingernähte für eine überragende Passgenauigkeit und vorgekrümmter Fingeraufbau zur Vermeidung von Ermüdungserscheinungen.  </li><li>Handteller-Verstärkungen aus synthetischem Wildleder für verbesserten Griffigkeit.</li><li>Perforierte Leder-Finger und -Fingerzwickel für die höchstmögliche Kühlung.  </li><li>Handgelenk-Klettverschluss und TPR Verzierungen und Drucklogos.</li></ul><br><p><strong>Material</p></strong><ul><li>38% LEDER</li><li>20% KUNSTLEDER</li><li>39%POLYURETHANE</li><li>3% ANDERE</li></ul><br><p><strong>Innenfutter</p></strong><ul><li>100%POLYESTER</li></ul>;;Alpinestars Handschuhe GPX - Integralschwarz Motogoodeal - Motorradspezialist;;Alpinestars Schlussverkauf - Die besten Preise der Saison!;;Auf Lager;Ausverkauft;;;;;;;;;;;;;;;;;
85254;;Alpinestars Handschuhe GPX - Schwarz/Weiss;;;;;;;;;;RPGASGL13121;;;;;;;;;;;;;;;;;Mit Alpinestars Strecke-getestetem fortschrittlichem Knöchel-Protektorsystem integriert der GPX Handschuh innovative Eigenschaften wie die patentierte Fingerbrücke und verstärkte Leder-Fingernähte für ausgezeichnete Abriebfestigkeit ebenso wie einen anatomisch vorgeformten Fingerschnitt zur Erhöhung des Fahrkomforts und Verringerung der Materialermüdung.;<p><strong>Anfertigung:</p></strong><ul><li>Dieser technisch konstruierte Handschuh integriert Leder, Wildleder und perforierte Ledereinsätze für Komfort und Atmungsaktivität.</li><li>Eingebaute Akkordeon-Stretcheinsätze aus Leder im ersten drei Fingern und Daumen für uneingeschränkte Beweglichkeit.  </li><li>Das kurze Bündchendesign zeichnet sich durch erweiterte gepolsterte Bund zur Deckung des Handgelenk-Außenbereiches.</li></ul><br><p><strong>Schutz</p></strong><ul><li>Alpinestars Strecke-getestetes Dual-Density Polymer Knöchel-Schutzsystem fördert die Belüftung und ist für eine überragende Aufprall- und Abriebleistung strukturiert. Das innovative offene Rücken-Design zeichnet sich durch ein perforiertes Oberpaneel für guten Bewegungsumfang aus.  </li><li>Die zusammengesetzten TPU Schleifer im kleinen Finger und Handballen sind auf hinterschäumte Lederpaneele für Komfort und Leistung angebracht.</li><li>Die patentierte dritte und vierte Fingerbrücke verhindert Abtrennung der Fingern und begrenzt Fingerverdrehung und geplatzte Nähte.  </li><li>Perforierte Polyschaum-Polsterung am Daumen, Bündchen und den Fingern.</li></ul><br><p><strong>Komfort</p></strong><ul><li>Leder-verstärkte Fingernähte für eine überragende Passgenauigkeit und vorgekrümmter Fingeraufbau zur Vermeidung von Ermüdungserscheinungen.  </li><li>Handteller-Verstärkungen aus synthetischem Wildleder für verbesserten Griffigkeit.</li><li>Perforierte Leder-Finger und -Fingerzwickel für die höchstmögliche Kühlung.  </li><li>Handgelenk-Klettverschluss und TPR Verzierungen und Drucklogos.</li></ul><br><p><strong>Material</p></strong><ul><li>38% LEDER</li><li>20% KUNSTLEDER</li><li>39%POLYURETHANE</li><li>3% ANDERE</li></ul><br><p><strong>Innenfutter</p></strong><ul><li>100%POLYESTER</li></ul>;;Alpinestars Handschuhe GPX - Schwarz/Weiss Motogoodeal - Motorradspezialist;;Alpinestars Schlussverkauf - Die besten Preise der Saison!;;Auf Lager;Ausverkauft;;;;;;;;;;;;;;;;;
85255;;Alpinestars Handschuhe HOXTON - Schwarz;;;;;;;;;;RPGASGL14102;;;;;;;;;;;;;;;;;Sport- und- Touring Hanschuh aus Kalbsleder - Schaumverstärkungen  auf der Handfläche Handrücken und Finger;<ul><li>Sport- und- Touring Hanschuh aus Kalbsleder </li><li>Schaumverstärkungen auf der Handfläche Handrücken und Finger</li></ul>;;Alpinestars Handschuhe HOXTON - Schwarz Motogoodeal - Motorradspezialist;;Alpinestars Schlussverkauf - Die besten Preise der Saison!;;Auf Lager;Ausverkauft;;;;;;;;;;;;;;;;;
85256;;Alpinestars Handschuhe ASAMA AIR - Schwarz/Blau;;;;;;;;;;RPGASGL141081;;;;;;;;;;;;;;;;; Alpinestars ist ein italienischer Hersteller, spezialisiert in Protektorenausstattung für Motorrad, Autorennen sowie mehreren Extremsportarten: M.T.B., BMX, Surfen, Wakeboard und sogar snow mobile.;"<ul><li>Mesh und Spandex Hauptschalenkonstruktion für eine hervorragende und haltbare Sommerhandschuh mit optimaler Belüftung</li><li>Clarino Wildleder für die Handfläche und Daumen mit zusätzlicher Clarino Verstärkungen an Handfläche, Daumen und Landezonen verwendet</li><li>Landezone enthält EVA Schaumstoffpolsterung Verstärkung</li><li>Erweiterte harte Polymer Knöchelprotektor ist ergonomisch unter dem oberen positioniert</li><li>Reflektoren an den Fingern für bessere Sichtbarkeit</li><li>Vorgeformte Finger Konstruktion reduziert Ermüdung des Fahrers</li><li>Top Fingern nehmen EVA-Schaum für Komfort und Polsterung</li><li>Spandex Fingerseitenwänden für Flexibilität</li><li>Haken und Ösen am Handgelenk für einfache Handschuh Einreise und sicheren Verschluss</li><li>Touchscreen-kompatiblen Fingerspitze auf dem Zeigefinger zur Verwendung mit Smartphones / GPS</li><li>Alpinestars gedruckten Logos auf Vorder- und Rückseite für zusätzlichen Halt</li><li>35% Synthetik Wildleder, 35% Polyamid, 25% Polyester und 5% Elasthan</li></ul><br><iframe width=""560"" height=""315"" src=""https://www.youtube.com/embed/tEdTH96p4BU?rel=0&amp;controls=0"" frameborder=""0"" allowfullscreen></iframe>";;Alpinestars Handschuhe ASAMA AIR - Schwarz/Blau Motogoodeal - Motorradspezialist;;Alpinestars Schlussverkauf - Die besten Preise der Saison!;;Auf Lager;Ausverkauft;;;;;;;;;;;;;;;;;
85257;;Alpinestars Handschuhe WARLOCK - Schwarz;;;;;;;;;;RPGASGL15101;;;;;;;;;;;;;;;;; Alpinestars ist ein italienischer Hersteller, spezialisiert in Protektorenausstattung für Motorrad, Autorennen sowie mehreren Extremsportarten: M.T.B., BMX, Surfen, Wakeboard und sogar snow mobile.;<ul><li>Lederhandschuhe mit verstärkter Handinnenfläche</li><li>Ergonomisch geformte Finger</li><li>Klettverschluss am Handgelenk</li><li>Kompatibel mit Touchscreen-Smartphone</li></ul>;;Alpinestars Handschuhe WARLOCK - Schwarz Motogoodeal - Motorradspezialist;;Alpinestars Schlussverkauf - Die besten Preise der Saison!;;Auf Lager;Ausverkauft;;;;;;;;;;;;;;;;;
85258;;Alpinestars Handschuhe ROBINSON - Braun;;;;;;;;;;RPGASGL158102;;;;;;;;;;;;;;;;;Stil und Leistung gehen für den Robinson Handschuh Hand in Hand, der einen geschmeidigen Leder-Oberteil mit Perforationszonen, EVA Schaumpolsterung und Verstärkungen in der Innenhandfläche für Komfort und Leistung integriert. Die OSCAR Verzierung vervollständigt den Vintage-Look dieses Handschuhs.;"<ul><li>Geschmeidiges Oberteil aus Ziegenleder für einen sanften luxuriösen Tragekomfort, welches dazu strapazierfähig und abriebfest ist.  </li><li>Oberteilstruktur aus perforiertem Leder für Belüftung und Komfort.</li><li>Verstärkungen aus synthetischem Wildleder in der Innenhand, dem Handballen, seitlicher Hand und dem kleinen Finger für Strapazierfähigkeit und zusätzliche Griffigkeit.  </li><li>Integriert Polsterung am Handballen für Komfort und zusätzlichen Schutz.</li><li>Verstärkungs-Knöchel aus EVA Schaumpolsterung sind unter dem Lederoberteil für verbesserte Formgestaltung integriert.</li><li>Handgelenk-Klettverschluss für einfaches Anziehen und sicheren Verschluss.    </li><li>Einzigartige Verzierungen im OSCAR-Stil vervollständigen den Vintage-Look.</li></ul><br><iframe width=""560"" height=""315"" src=""https://www.youtube.com/embed/tZbrBFLkDos?rel=0&amp;controls=0"" frameborder=""0"" allowfullscreen></iframe>";;Alpinestars Handschuhe ROBINSON - Braun Motogoodeal - Motorradspezialist;;Alpinestars Schlussverkauf - Die besten Preise der Saison!;;Auf Lager;Ausverkauft;;;;;;;;;;;;;;;;;
