85282;;Alpinestars Kombi ATEM - Schwarz/Weiss;;;;;;;;;;RPGASLS15123;;;;;;;;;;;;;;;;;Voll-umfänglich geprüft und aus hochwertigem geschmeidigem Leder ist die Atem Lederkombi für die Strecke- und Straße-Einsatz optimal. Mit den in MotoGP entwickelten und umfangreich getesteten Technologien schmelzt die Atem Kombi einzigartiges ergonomisches Design und erstklassige Schutztechnologie ein, die zu einer beeindruckenden Leistungsfahren-Kombi führen.;"<p><strong>Anfertigung</p></strong><ul><li>Voll-umfänglich CE zertifiziertes Kleidungsstück. Die Zertifizierung beeinschließt alle Materialien, Aufbau/Anfertigung und Protektoren, die unabhängig getestet und bewertet worden sind, um die Leistungsanforderungen nach der EN 13595 - 1 Norm zu entsprechen.  </li><li>Extrem robuster 1.3 mm Lederaufbau mit flexiblen Aramidfaser-Stretcheinsätze aus Leder im Lenden-, Rücken-, Knie- und Ellbogen-Bereich für hervorragenden Komfort und Leistungspassform.</li><li>Der Moto-GP profilierte aerodynamische belüftete Rückenhöcker verbessert die Kühlungsleistung der Kombi.</li><li>Strategisch platzierte perforierte Panels auf dem Ober- und Unterkörper für bessere Belüftung.</li></ul><br><p><strong>Schutz</p></strong><ul><li>Brusttaschen mit fortschrittlicher Polsterung aus Polyesterschaum (Alpinestars Bionic-Brustprotektoren als Upgrade-Zubehör erhältlich).</li><li>Herausnehmbare CE-zertifizierte rennerprobte innere GP-R Beschützer bieten federleichte Leistung und überragenden Aufprallschutz an Schultern, Ellbogen, Knien, Tibia und Schienbein.</li><li>Druckknopf-Mehrfachsystem zur Einbau des Alpinestars CE-zertifizierten Bionic Rückenprotektors, der als Zubehör erhältlich ist.</li></ul><br><p><strong>Komfort</p></strong><ul><li>Neopren-kantiger Kragen und Bündchen schützen vor Wundreiben und verbessern den Komfort.</li><li>Inneres Bein und Manschette weisen Verschlüsse mit Griffeinlage aus Taslon und Nylon auf, um die Kombi körpernah zu halten.    </li><li>Verstärkte innere Armbündchen- und Beinabschluss-Verstellungen für Dauerhaftigkeit und verbesserte Sicherheitsleistung.  </li><li>Herausnehmbares Multi-Panel-Futter und neu-gestaltete 3D Mesh-Einsätze zur Verbesserung des Komforts und der Belüftung.</li><li>Bahnbrechender Wade-Erweiterungszwickel mit Reißverschluss verbessert Passform-Möglichkeiten und Fahrkomfort.</li><li>Innere wasserfeste Tasche für sichere Aufbewahrung.  </li></ul><br><iframe width=""560"" height=""315"" src=""https://www.youtube.com/embed/xGaUtEZHntU?rel=0&amp;controls=0"" frameborder=""0"" allowfullscreen></iframe>";;Alpinestars Kombi ATEM - Schwarz/Weiss Motogoodeal - Motorradspezialist;;Alpinestars Schlussverkauf - Die besten Preise der Saison!;;Auf Lager;Ausverkauft;;;;;;;;;;;;;;;;;
85283;;Alpinestars Hose OXYGEN AIR OVERPANTS - Schwarz;;;;;;;;;;RPGASPA12101;;;;;;;;;;;;;;;;;Alpinestars Hosen entworfen über Casual Hosen getragen zu werden, ist die Hose über Oxygen Air ein innovativer Vorschlag für den Sommer. CE Knieprotektoren und strapazierfähigem Polyester-Struktur bieten eine ausgezeichnete Beständigkeit gegen Schlag und Abrieb, Scharniere an der Wade einfacher An-und Ausziehen auch mit Stiefeln. Sauerstoff Luft Überhose;<ul><li>600 Denier Polyester-Gewebe beschichtete PU, mit großen Mesh-Einsätze an den Oberschenkeln für optimalen Fahrkomfort</li><li>Paneele Umklappen auf meinem Rücken und Knien für erhöhte Flexibilität</li><li>Reflexstreifen für verbesserte Sichtbarkeit bei Nacht </li><li>PE-Polsterung mit ergonomischen Nähten an den Seiten</li><li>CE-geprüften Protektoren an den Knien bieten hohen Aufprallschutz </li><li>Die volle Länge Reißverschluss vom Knie bis zum Knöchel erleichtert das Anziehen der Hose mit Stiefeln</li><li>Scharniere YKK ® High-Level-Garantie perfekten Abschluss zu allen Zeiten</li></ul>;;Alpinestars Hose OXYGEN AIR OVERPANTS - Schwarz Motogoodeal - Motorradspezialist;;Alpinestars Schlussverkauf - Die besten Preise der Saison!;;Auf Lager;Ausverkauft;;;;;;;;;;;;;;;;;
85284;;Alpinestars Hose STELLA VIKA - Schwarz;;;;;;;;;;RPGASPC13101;;;;;;;;;;;;;;;;;Sport- und- Urban Hose aus 1,1 mm Vollleder - Aramid-Stretch-Einsatz im Schritt ;0;;Alpinestars Hose STELLA VIKA - Schwarz Motogoodeal - Motorradspezialist;;Alpinestars Schlussverkauf - Die besten Preise der Saison!;;Auf Lager;Ausverkauft;;;;;;;;;;;;;;;;;
85285;;Alpinestars Hose MISSILE - Schwarz;;;;;;;;;;RPGASPC14101;;;;;;;;;;;;;;;;;Aus  höchst  strapazierfähigem  Vollnarbenleder  mit  einem  verstärkten  Sitzbereich  und  gestärkten  Nähte  integriert  die Missile  Lederhose  herausnehmbaren Schutz und ausgedehnte Stretch-Paneele. Diese Hose  ist für den Anschluss an einer Reihe von Alpinestars Sport- und Leistungsfahren-Jacken optimiert.;"<ul><li>Höchst strapazierfähiges Multi-Paneel Anfertigung aus Vollnarbenleder für hervorragende Abriebfestigkeit, mit verstärkten Mehrfach- Nähte für eine optimale Reißfestigkeit beim Aufprallsfall.  </li><li>Herausnehmbare Knie- und Schienbeinschützer für erstklassige Sicherheit.  </li><li>Austauschbare Schaum-Hüfteinsätze für Komfort und zusätzliche Aufprallleistung (Hüftschutz als Upgrade-Zubehör erhältlich).</li><li>Akkordeon-Stretcheinsätze aus Leder über dem Knie für verbesserte Flexibilität.  </li><li>Vorderen Tailleverschluss mit Druckknopf und Haken für Sicherheit und strapazierfähigem Frontreißverschluss.</li><li>Großflächige Stretcheinsätze aus Polyestergewebe im inneren Beinbereich und Schrittpartie verbessert die Flexibilität und verringern gleichzeitig das Gewicht der Kombi.  </li><li>Verlängerter hinterer Taillenaufbau leistet bessere Überdeckung der Jacke und gewährleistet stets den höchstmöglichen Bekleidungsschutz des Körpers.   </li><li>Inneres Mesh-Futter mit Stretcheinsätze arbeitet im Zusammenspiel mit äußeren Bereichen für deutlich bessere Bewegungsfreiheit. Futter ist herausnehmbar und waschbar.</li><li>Innen verstärkte Sitzfläche und Kniebereich unterstützen Abriebschutz und verhindern die Verformung der Bekleidung infolge der hohen Reibungskraft beim Rutschen.  </li><li>Waden-Erweiterungszwickel mit Reißverschluss zur Anpassung an unterschiedlichen Beingrößen.  </li><li>Vorgekrümmter Beinaufbau verhindert Fahrermüdung und unterstützt sportliche Passform.  </li><li>Taillenweite mit Klettverschluss und D-Ringschnallen für festen und personalisierten Verschluss.  </li><li>Der Taillen-Verbindungsreißverschluß ermöglicht den Anschluss an den Alpinestars Jacken.</li><li>Reflexdetails im Vorder- und Rückenbereich zur Verbesserung der Fahrersichtbarkeit.   </li><li>Austauschbare Sport-Knieschleifer für ausgezeichnete Aufprall- und Abriebfestigkeit.</li></ul><br><iframe width=""560"" height=""315"" src=""https://www.youtube.com/embed/3gpkkfaEYmE?controls=0&amp;showinfo=0"" frameborder=""0"" allowfullscreen></iframe>";;Alpinestars Hose MISSILE - Schwarz Motogoodeal - Motorradspezialist;;Alpinestars Schlussverkauf - Die besten Preise der Saison!;;Auf Lager;Ausverkauft;;;;;;;;;;;;;;;;;
85286;;Alpinestars Hose MISSILE (LONG) - Schwarz;;;;;;;;;;RPGASPC14103;;;;;;;;;;;;;;;;;Aus  höchst  strapazierfähigem  Vollnarbenleder  mit  einem  verstärkten  Sitzbereich  und  gestärkten  Nähte  integriert  die Missile  Lederhose  herausnehmbaren Schutz und ausgedehnte Stretch-Paneele. Diese Hose  ist für den Anschluss an einer Reihe von Alpinestars Sport- und Leistungsfahren-Jacken optimiert.;"<ul><li>Höchst strapazierfähiges Multi-Paneel Anfertigung aus Vollnarbenleder für hervorragende Abriebfestigkeit, mit verstärkten Mehrfach- Nähte für eine optimale Reißfestigkeit beim Aufprallsfall.  </li><li>Herausnehmbare Knie- und Schienbeinschützer für erstklassige Sicherheit.  </li><li>Austauschbare Schaum-Hüfteinsätze für Komfort und zusätzliche Aufprallleistung (Hüftschutz als Upgrade-Zubehör erhältlich).</li><li>Akkordeon-Stretcheinsätze aus Leder über dem Knie für verbesserte Flexibilität.  </li><li>Vorderen Tailleverschluss mit Druckknopf und Haken für Sicherheit und strapazierfähigem Frontreißverschluss.</li><li>Großflächige Stretcheinsätze aus Polyestergewebe im inneren Beinbereich und Schrittpartie verbessert die Flexibilität und verringern gleichzeitig das Gewicht der Kombi.  </li><li>Verlängerter hinterer Taillenaufbau leistet bessere Überdeckung der Jacke und gewährleistet stets den höchstmöglichen Bekleidungsschutz des Körpers.   </li><li>Inneres Mesh-Futter mit Stretcheinsätze arbeitet im Zusammenspiel mit äußeren Bereichen für deutlich bessere Bewegungsfreiheit. Futter ist herausnehmbar und waschbar.</li><li>Innen verstärkte Sitzfläche und Kniebereich unterstützen Abriebschutz und verhindern die Verformung der Bekleidung infolge der hohen Reibungskraft beim Rutschen.  </li><li>Waden-Erweiterungszwickel mit Reißverschluss zur Anpassung an unterschiedlichen Beingrößen.  </li><li>Vorgekrümmter Beinaufbau verhindert Fahrermüdung und unterstützt sportliche Passform.  </li><li>Taillenweite mit Klettverschluss und D-Ringschnallen für festen und personalisierten Verschluss.  </li><li>Der Taillen-Verbindungsreißverschluß ermöglicht den Anschluss an den Alpinestars Jacken.</li><li>Reflexdetails im Vorder- und Rückenbereich zur Verbesserung der Fahrersichtbarkeit.   </li><li>Austauschbare Sport-Knieschleifer für ausgezeichnete Aufprall- und Abriebfestigkeit.</li></ul><br><iframe width=""560"" height=""315"" src=""https://www.youtube.com/embed/3gpkkfaEYmE?controls=0&amp;showinfo=0"" frameborder=""0"" allowfullscreen></iframe>";;Alpinestars Hose MISSILE (LONG) - Schwarz Motogoodeal - Motorradspezialist;;Alpinestars Schlussverkauf - Die besten Preise der Saison!;;Auf Lager;Ausverkauft;;;;;;;;;;;;;;;;;
85287;;Alpinestars Hose STELLA MISSILE - Schwarz;;;;;;;;;;RPGASPC14104;;;;;;;;;;;;;;;;;Für eine spezifische Damen-Leistungspassform entwickelt und gefertigt integrieren die Stella Missile Lederhose ein höchst strapazierfähiges Vollnarbenleder mit verstärktem Sitzbereich und gestärkten Nähte. Für den Anschluss an einer Reihe von  Leistungsfahren-Jacken  aus  der  Alpinestars Sport- und Stella-Kollektion optimiert, zeichnen sich diese Hose durch erstklassigen Schutz aus.;<ul><li>Höchst strapazierfähiges Multi-Paneel Anfertigung aus Vollnarbenleder für hervorragende Abriebfestigkeit, mit verstärkten Mehrfach- Nähte für eine optimale Reißfestigkeit beim Aufprallsfall.  </li><li>Optimierte Passform und Größeneinteilung sind speziell für die weibliche Figur entwickelt.</li><li>Herausnehmbare Knie- und Schienbeinschützer für erstklassige Sicherheit.  </li><li>Austauschbare Schaum-Hüfteinsätze für Komfort und zusätzliche Aufprallleistung (Hüftschutz als Upgrade-Zubehör erhältlich).</li><li>Akkordeon-Stretcheinsätze aus Leder über dem Knie für verbesserte Flexibilität.  </li><li>Vorderen Tailleverschluss mit Druckknopf und Haken für Sicherheit und strapazierfähigem Frontreißverschluss.</li><li>Großflächige Stretcheinsätze aus Polyestergewebe im inneren Beinbereich und Schrittpartie verbessert die Flexibilität und verringern gleichzeitig das Gewicht der Kombi.  </li><li>Verlängerter hinterer Taillenaufbau leistet bessere Überdeckung der Jacke und gewährleistet stets den höchstmöglichen Bekleidungsschutz des Körpers.   </li><li>Inneres Mesh-Futter mit Stretcheinsätze arbeitet im Zusammenspiel mit äußeren Bereichen für deutlich bessere Bewegungsfreiheit. Futter ist herausnehmbar und waschbar.</li><li>Innen verstärkte Sitzfläche und Kniebereich unterstützen Abriebschutz und verhindern die Verformung der Bekleidung infolge der hohen Reibungskraft beim Rutschen.  </li><li>Waden-Erweiterungszwickel mit Reißverschluss zur Anpassung an unterschiedlichen Beingrößen.  </li><li>Vorgekrümmter Beinaufbau verhindert Fahrermüdung und unterstützt sportliche Passform.  </li><li>Taillenweite mit Klettverschluss und D-Ringschnallen für festen und personalisierten Verschluss.  </li><li>Der Taillen-Verbindungsreißverschluß ermöglicht den Anschluss an den Alpinestars Jacken.</li><li>Reflexdetails im Vorder- und Rückenbereich zur Verbesserung der Fahrersichtbarkeit.   </li><li>Austauschbare Sport-Knieschleifer für ausgezeichnete Aufprall- und Abriebfestigkeit.</li><li>Material: 90%LEDER 10%POLYAMIDE</li></ul>;;Alpinestars Hose STELLA MISSILE - Schwarz Motogoodeal - Motorradspezialist;;Alpinestars Schlussverkauf - Die besten Preise der Saison!;;Auf Lager;Ausverkauft;;;;;;;;;;;;;;;;;
85288;;Alpinestars Hose TRACK - Schwarz;;;;;;;;;;RPGASPC15101;;;;;;;;;;;;;;;;;Profihose aus Vollleder, in der ergonomisches Design und fortschrittliche Schutzsysteme gekonnt miteinander verbunden wurden. Der hintere Bereich der erhöhten Taille sorgt für optimalen Schutz und ist mit einem Verbindungsreißverschluss ausgerüstet, mit dem die Track Hose an eine Reihe von Alpinestars Lederjacken verbunden werden kann.;<ul><li>Außerordentlich abriebfestes und elastisches 1,3 mm Vollleder.</li><li>Mehrfachnähte für eine höhere Reißfestigkeit.</li><li>Stretch?Panels aus Kevlar® in ergonomischer Position für eine optimale Flexibilität.</li><li>Hochwertige, selbstarretierende YKK®?Zipper für einen stets sicheren Verschluss.</li><li>Austauschbare Alpinestars Sport?Sliders fürs Knie.</li></ul><br><p><strong>Fortschrittliche Sicherheitseigenschaften</strong></p><ul><li>Herausnehmbare geprüfte Protektoren für eine optimale Abriebfestigkeit.</li><li>Das intern verstärkte Gesäß gewährleistet einen hohen Abriebschutz und vermeidet die Verformung der Hose aufgrund von Beanspruchungen durch Rutschen bei Unfällen.</li><li>Eingearbeitete Polsterung an den Hüften für einen höheren Komfort und Aufprallschutz.</li><li>Der hintere Bereich der erhöhten Taille schafft eine größer Überlagerungsfläche mit der Motorradjacke, damit der Körper in jeder Situation stets absolut geschützt ist.</li></ul><br><p><strong>Komfort innerhalb und außerhalb der Piste</strong></p><ul><li>Perforierte Leder?Panels für eine bessere Belüftung.</li><li>Patentierte Dehneinsätze am unteren Hosenbein zur Regulierung der Wadenweite.</li><li>Innenfutter mit Stretch?Einsätzen kombiniert mit externen Flex?Zonen für eine höhere Bewegungsfreiheit.</li></ul>;;Alpinestars Hose TRACK - Schwarz Motogoodeal - Motorradspezialist;;Alpinestars Schlussverkauf - Die besten Preise der Saison!;;Auf Lager;Ausverkauft;;;;;;;;;;;;;;;;;
85289;;Alpinestars Hose STELLA KERRY TECH DENIM - Blau;;;;;;;;;;RPGASPL13752;;;;;;;;;;;;;;;;;Damen-Jeans, die sehr widerstandsfähig gegen Abrieb-und Schlagfestigkeit dank Verstärkungen in Kevlar ist, wird die Kerry Denim speziell von der Abteilung Alpinestars feminines Design, um den weiblichen Körper zu verbessern entworfen. Verstärkte Nähte erhöhen die Funktionalität der Jeans und benutzerdefinierte Nieten und Leder-Details bieten einen Hauch von Stil;<ul><li>Hergestellt speziell feminines Design Alpinestars von der Abteilung für den weiblichen Körperbau.</li><li>Denim geraden Schnitt von 12 Unzen fit für einen modischen und hervorragende Haltbarkeit.</li><li>•Interne Verstärkungen in Kevlar ® auf dem Pferderücken, Hüften und Knie bieten eine ausgezeichnete Beständigkeit gegen Abrieb-und Reißfestigkeit in kritischen Bereichen.</li><li>Innenfächer am Knie erlauben eine perfekte Positionierung der CE zertifizierte Protektoren an verschiedenen Beinlängen</li><li>5mm abnehmbare Protektoren an den Seiten mit Velcro -Verbindung für eine sichere Passform und eng.</li><li>•Robuste Haupt-Doppel-Naht für Haltbarkeit.</li><li>Struktur vorgebogener Bein anatomisch für die Sitzposition der weiblichen Physis optimiert.</li></ul>;;Alpinestars Hose STELLA KERRY TECH DENIM - Blau Motogoodeal - Motorradspezialist;;Alpinestars Schlussverkauf - Die besten Preise der Saison!;;Auf Lager;Ausverkauft;;;;;;;;;;;;;;;;;
85290;;Alpinestars Hose TOM CANVAS - Schwarz;;;;;;;;;;RPGASPL15101;;;;;;;;;;;;;;;;;Diese Regular/Slim geschnittene Jeans in Vintage-Stil sind für das alltägliche Motorradfahren gestaltet worden. Sie weisen Aramidfaser- Verstärkungen für ausgezeichnete Abriebfestigkeit und zertifizierte Knieschoner auf, die für die unterschiedlichen Beingrößen personalisiert werden können. Ausdehnbares Elastan-Twill bedeutet, dass diese Jeans die Konturen des Beines folgen, und somit eine äußerst komfortable Ergänzung im Kleiderschrank jegliches Motorradfahrers bietet.;<ul><li>Taillierte Cargo-geschnittene Tragepassform mit Hauptstruktur aus schwerem der Strapazierfähigkeit halber beharztem Baumwollsegeltuch/Elastan.</li><li>Die innere Aramidfaser-Verstärkung in Sitzpartie und im Knie-Bereich bietet ausgezeichnete Abrieb- und Reißfestigkeit in kritischen Aufprallbereichen.</li><li>Inneres Kniefach ermöglicht die Verstellung des zertifizierten Knieschutzes zur Anpassung an den unterschiedlichen Beinlängen.</li><li>Individuelle OSCAR Verzierungen auf YKK Metall-Reißverschluss, Knöpfe und Niete.</li><li>Authentische Vintage-Gurtpatte aus Leder und Kleingeldtasche.</li><li>Material 100% Baumwolle</li></ul>;;Alpinestars Hose TOM CANVAS - Schwarz Motogoodeal - Motorradspezialist;;Alpinestars Schlussverkauf - Die besten Preise der Saison!;;Auf Lager;Ausverkauft;;;;;;;;;;;;;;;;;
85291;;Alpinestars Hose CHARLIE DENIM - Blau;;;;;;;;;;RPGASPL15701;;;;;;;;;;;;;;;;;Aus einem speziell angefertigten schweren Denim-Gewebe mit integriertem Elastan für formschlüssigen Komfort beim Motorrad-Fahren als auch beim Gehen weist die Charlie Denim Hose einen zeitlosen American-Vintage Look auf, eine Erinnerung an den ikonischen Tagen des Motorradfahrens. Diese slim/regular Jeans sind für den Alltag und integrieren zertifizierte Knieschoner, die für die unterschiedliche Beingrößen personalisiert werden können.;<ul><li>Hauptmaterial aus schwerem Denim mit Regular/Slim Passform integriert Elastan zur Verbesserung des Fahrkomforts und der Rundum-Passform.</li><li>Die innere Aramidfaser-Verstärkung in Sitzpartie und im Knie-Bereich bietet ausgezeichnete Abrieb- und Reißfestigkeit in kritischen Aufprallbereichen.</li><li>Inneres Kniefach ermöglicht die Verstellung des zertifizierten Knieschutzes zur Anpassung an den unterschiedlichen Beinlängen.</li><li>Starker doppelter Hauptnähte-Aufbau für zusätzliche Dauerhaftigkeit.</li><li>Individuelle OSCAR Verzierungen auf YKK Metall-Reißverschluss, Knöpfe und Niete.</li><li>Authentische Vintage-Gurtpatte aus Leder und Kleingeldtasche.</li><li>Material 100% Baumwolle</li></ul>;;Alpinestars Hose CHARLIE DENIM - Blau Motogoodeal - Motorradspezialist;;Alpinestars Schlussverkauf - Die besten Preise der Saison!;;Auf Lager;Ausverkauft;;;;;;;;;;;;;;;;;
85292;;Alpinestars Hose STELLA RILEY TECH DENIM - Indigo;;;;;;;;;;RPGASPL16101;;;;;;;;;;;;;;;;; Alpinestars ist ein italienischer Hersteller, spezialisiert in Protektorenausstattung für Motorrad, Autorennen sowie mehreren Extremsportarten: M.T.B., BMX, Surfen, Wakeboard und sogar snow mobile.;<ul><li>Urban adventure im strech denim</li><li>Kevlar-verstärkte Strecheinsätze auf den Knien, Hüften und Hintern</li><li>anpassbare Knieprotektoren</li><li>herausnehmbare Hüftprotektoren</li></ul>;;Alpinestars Hose STELLA RILEY TECH DENIM - Indigo Motogoodeal - Motorradspezialist;;Alpinestars Schlussverkauf - Die besten Preise der Saison!;;Auf Lager;Ausverkauft;;;;;;;;;;;;;;;;;
85293;;Alpinestars Hose EXPRESS DS OVERPANTS - Schwarz;;;;;;;;;;RPGASPM12102;;;;;;;;;;;;;;;;;Die Express Drystar Überhosen sind für das Tragen über die Freizeithosen entwickelt, um einen effektiven Abrieb- und Aufprall-Schutz sowie eine 100% wasserfeste Leistung beim Motorradfahren bei ungünstiger Wetterbedingungen gewährzuleisten. Ein abnehmbares Thermalfutter garantiert komfortables Fahren bei frischerer Wetterbedingungen, während ein langer Reißverschlußzwickel das An- und Ausziehen der Hosen über die Stiefel schnell und leicht macht.;"<ul><li>Gefertigt aus PU beschichteter 600 Denier Stoffe mit Knie- und Sitz-Verstärkungen.</li><li>Vorgekrümmtes Beindesign gewährleistet eine überragende Passform.</li><li>Wasserfeste und atmungsaktive Drystar® Membran gewährleistet eine ausgezeichnete Allwetter-Leistungsfähigkeit.</li><li>Herausnehmbares Thermalfutter garantiert höchstmöglichen Komfort bei frischeren Wetterbedingungen.</li><li>Ergonomisch taillierte PE Komfortpolsterung auf die Hüften.</li><li>zertifizierte Knieprotektoren bieten höchstmöglichen Aufprallschutz.</li><li>Ein langer Reißverschlußzwickel vom Knie zum Hosesaum ermöglicht leichtes An- und Ausziehen über die Motorradstiefel.</li><li>Reflexpaspel für verbesserte Nachtsichbarkeit.</li><li>Taillen-Verbindungsreißverschluß ermöglicht Verbindung mit ausgewählten Alpinestars Leder- und Textil-Jacken.</li><li>Verstellbare Taillenweite durch gesicherte Gleithakenverschluss.</li><li>Hochwertige YKK® Reißverschlüsse.</li></ul><br><iframe width=""560"" height=""315"" src=""https://www.youtube.com/embed/IJx8hXohrDA?controls=0&amp;showinfo=0"" frameborder=""0"" allowfullscreen></iframe>";;Alpinestars Hose EXPRESS DS OVERPANTS - Schwarz Motogoodeal - Motorradspezialist;;Alpinestars Schlussverkauf - Die besten Preise der Saison!;;Auf Lager;Ausverkauft;;;;;;;;;;;;;;;;;
85294;;Alpinestars Hose TECH ROAD GTX ARMACOR - Schwarz;;;;;;;;;;RPGASPM12103;;;;;;;;;;;;;;;;;Alpinestars Tech Road GORE-TEX® Pants vereint hochwertige Materialien und fortschrittliche Fertigungsmethoden für konkurrenzlose Allwettereigenschaften. Das Obermaterial besteht aus GORE-TEX® Pro-Shell-Gewebe für unübertroffenen Wetterschutz und Robustheit, während die vorgeformte Beinkonstruktion den Tragekomfort und Sitz beim Fahren verbessert.;"<p><strong>Konkurrenzloser Wetterschutz</strong></p><ul><li>GORE-TEX® Pro-Shell-Gewebe als Hauptmaterial an der Außenschicht bietet unübertroffenen Wetterschutz, Robustheit und Qualität.</li><li>Abnehmbares, in voller Länge gestepptes Innenfutter verbessert Tragekomfort und Wetterschutz bei kaltem Wetter.</li><li>Optimiert für die Verwendung zusammen mit dem Tech Road GORE-TEX® Jacket.</li></ul><br><p><strong>Fortschrittliche Sicherheit</strong></p><ul><li></li><li>Strategisch platzierte GORE-TEX® Armacor®-Einsätze bieten außergewöhnliche Abrieb- und Reißfestigkeit an den wichtigsten Bereichen.</li><li>Leichte, qualitativ hochwertige, zertifizierte Knie-/Schienbeinschützer bieten außerordentlichen Aufprallschutz.</li><li>Hüftfächer mit ergonomischer keilförmiger PE-Schutzpolsterung.</li><li>Gut sichtbare reflektierende Streifen und Logos verbessern die Erkennbarkeit des Fahrers bei schlechten Lichtverhältnissen.</li></ul><br><p><strong>Vielseitig konfigurierbar</strong></p><ul><li>Ausgeprägt vorgeformte Beinkonstruktion.</li><li>Abnehmbare Hosenträger bieten alternativ bequem anpassbare passform.</li><li>Große Cargo-Taschen mit überdimensionaler Öffnung für einfachen Zugriff.</li><li>Überdimensionale D-Ring Bundjustierung und Erweiterungs-Zwickel mittels Reißverschluss am unteren Beinende für maßgeschneiderten Sitz.</li><li>Innenliegender Verbindungsreißverschluss für die Anknüpfung einer Motorradjacke.</li><li>Leicht zu bedienende Mikro-Klettverschlüsse wie in der gesamten Bekleidungsindustrie verwendet.</li><li>Premium YKK Zippverschlüsse.</li><li>Material 97%POLYAMIDE 3%LEDER; Futter: 98%POLYAMIDE 2%ELASTANE. Enthält nicht textile Teile tierischen Ursprungs.</li></ul>";;Alpinestars Hose TECH ROAD GTX ARMACOR - Schwarz Motogoodeal - Motorradspezialist;;Alpinestars Schlussverkauf - Die besten Preise der Saison!;;Auf Lager;Ausverkauft;;;;;;;;;;;;;;;;;
